1,A,Agilent Technologies Inc.,stocks,us,XNYS,CS,usd
2844,DLB,"Dolby Laboratories, Inc.Class A",stocks,us,XNYS,CS,usd
2845,DLHC,DLH Holdings Corp.,stocks,us,XNAS,CS,usd
2846,DLLL,GraniteShares 2x Long DELL Daily ETF,stocks,us,XNAS,ETF,usd
2847,DLN,WisdomTree U.S. LargeCap Dividend Fund,stocks,us,ARCX,ETF,usd
2848,DLNG,DYNAGAS LNG PARNERS LP,stocks,us,XNYS,CS,usd
2849,DLNGpA,"Dynagas LNG Partners LP 9.00% Series A Cumulative Redeemable Preferred Units, liquidation preference $25.00 per Unit",stocks,us,XNYS,PFD,usd
2850,DLO,DLocal Limited Class A Common Shares,stocks,us,XNAS,CS,usd
2851,DLPN,"Dolphin Entertainment, Inc.",stocks,us,XNAS,CS,usd
2852,DLR,"Digital Realty Trust, Inc.",stocks,us,XNYS,CS,usd
2853,DLRpJ,"Digital Realty Trust, Inc. 5.250% Series J Cumulative Redeemable Preferred Stock",stocks,us,XNYS,PFD,usd
2854,DLRpK,"Digital Realty Trust, Inc. 5.850% Series K Cumulative Redeemable Preferred Stock, par value $0.01 per share",stocks,us,XNYS,PFD,usd
2855,DLRpL,"Digital Realty Trust, Inc. 5.200% Series L Cumulative Redeemable Preferred Stock",stocks,us,XNYS,PFD,usd
2856,DLS,WisdomTree International SmallCap Dividend Fund,stocks,us,ARCX,ETF,usd
2857,DLTH,Duluth Holdings Inc. Class B Common Stock,stocks,us,XNAS,CS,usd
2858,DLTR,Dollar Tree Inc.,stocks,us,XNAS,CS,usd
2859,DLX,Deluxe Corporation,stocks,us,XNYS,CS,usd
2860,DLXY,Delixy Holdings Limited Ordinary Shares,stocks,us,XNAS,CS,usd
2861,DLY,DoubleLine Yield Opportunities Fund,stocks,us,XNYS,FUND,usd
2862,DMA,Destra Multi-Alternative Fund,stocks,us,XNYS,FUND,usd
2863,DMAA,Drugs Made In America Acquisition Corp. Ordinary Shares,stocks,us,XNAS,CS,usd
2864,DMAAR,Drugs Made In America Acquisition Corp. Rights,stocks,us,XNAS,RIGHT,usd
2865,DMAAU,Drugs Made In America Acquisition Corp. Units,stocks,us,XNAS,UNIT,usd
2866,DMAC,DiaMedica Therapeutics Inc. Common Stock,stocks,us,XNAS,CS,usd
2867,DMAR,FT Vest U.S. Equity Deep Buffer ETF - March,stocks,us,BATS,ETF,usd
2868,DMAT,Global X Disruptive Materials ETF,stocks,us,XNAS,ETF,usd
2869,DMAX,iShares Large Cap Max Buffer Dec ETF,stocks,us,BATS,ETF,usd
2870,DMAY,FT Vest U.S. Equity Deep Buffer ETF - May,stocks,us,BATS,ETF,usd
2871,DMB,"BNY Mellon Municipal Bond Infrastructure Fund, Inc.",stocks,us,XNYS,FUND,usd
2872,DMBS,DoubleLine Mortgage ETF,stocks,us,ARCX,ETF,usd
2873,DMCY,Democracy International Fund,stocks,us,ARCX,ETF,usd
2874,DMIIU,Drugs Made In America Acquisition II Corp. Unit,stocks,us,XNAS,UNIT,usd
2875,DMLP,Dorchester Minerals LP,stocks,us,XNAS,CS,usd
2876,DMO,Western Asset Mortgage Opportunity Fund Inc.,stocks,us,XNYS,FUND,usd
2877,DMRC,Digimarc Corporation,stocks,us,XNAS,CS,usd
2878,DMX,DoubleLine Multi-Sector Income ETF,stocks,us,ARCX,ETF,usd
2879,DMXF,iShares ESG Advanced MSCI EAFE ETF,stocks,us,XNAS,ETF,usd
2880,DNA,"Ginkgo Bioworks Holdings, Inc.",stocks,us,XNYS,CS,usd
2881,DNL,WisdomTree Global ex-U.S. Quality Growth Fund,stocks,us,ARCX,ETF,usd
2882,DNLI,Denali Therapeutics Inc. Common Stock,stocks,us,XNAS,CS,usd
2883,DNN,Denison Mines Corp,stocks,us,XASE,CS,usd
2884,DNOV,FT Vest U.S. Equity Deep Buffer ETF - November,stocks,us,BATS,ETF,usd
2885,DNOW,DNOW Inc.,stocks,us,XNYS,CS,usd
2886,DNP,DNP Select Income Fund Inc.,stocks,us,XNYS,FUND,usd
2887,DNTH,"Dianthus Therapeutics, Inc. Common Stock",stocks,us,XNAS,CS,usd
2888,DNUT,"Krispy Kreme, Inc. Common Stock",stocks,us,XNAS,CS,usd
2889,DOC,"Healthpeak Properties, Inc.",stocks,us,XNYS,CS,usd
2890,DOCN,"DigitalOcean Holdings, Inc.",stocks,us,XNYS,CS,usd
2891,DOCS,"Doximity, Inc.",stocks,us,XNYS,CS,usd
2892,DOCT,FT Vest U.S. Equity Deep Buffer ETF - October,stocks,us,BATS,ETF,usd
2893,DOCU,"DocuSign, Inc. Common Stock",stocks,us,XNAS,CS,usd
2894,DOG,ProShares Short Dow30,stocks,us,ARCX,ETF,usd
2895,DOGD,Tradr 2X Long DDOG Daily ETF,stocks,us,BATS,ETF,usd
2896,DOGG,FT Vest DJIA Dogs 10 Target Income ETF,stocks,us,BATS,ETF,usd
2897,DOGZ,Dogness (International) Corporation Class A Common Stock,stocks,us,XNAS,CS,usd
2898,DOJE,REX-Osprey DOGE ETF,stocks,us,BATS,ETF,usd
2899,DOL,WisdomTree True Developed International Fund,stocks,us,ARCX,ETF,usd
2900,DOLE,Dole plc,stocks,us,XNYS,CS,usd
2901,DOMH,Dominari Holdings Inc. Common Stock,stocks,us,XNAS,CS,usd
2902,DOMO,"Domo, Inc. Class B Common Stock",stocks,us,XNAS,CS,usd
2903,DON,WisdomTree U.S. MidCap Dividend Fund,stocks,us,ARCX,ETF,usd
2904,DOOO,BRP Inc. Common Subordinate Voting Shares,stocks,us,XNAS,CS,usd
2905,DORM,"Dorman Products, Inc. New",stocks,us,XNAS,CS,usd
2906,DOUG,Douglas Elliman Inc.,stocks,us,XNYS,CS,usd
2907,DOV,Dover Corporation,stocks,us,XNYS,CS,usd
2908,DOW,Dow Inc.,stocks,us,XNYS,CS,usd
2909,DOX,Amdocs Limited,stocks,us,XNAS,CS,usd
2910,DOYU,DouYu International Holdings Limited ADS,stocks,us,XNAS,ADRC,usd
2911,DPG,Duff & Phelps Utility and Infrastructure Fund Inc.,stocks,us,XNYS,FUND,usd
2912,DPRO,Draganfly Inc. Common Shares,stocks,us,XNAS,CS,usd
2913,DPST,Direxion Daily Regional Banks Bull 3X Shares,stocks,us,ARCX,ETF,usd
2914,DPZ,Domino's Pizza Inc.,stocks,us,XNAS,CS,usd
2915,DQ,Daqo New Energy Corp. American Depositary Shares (each representing 5 Ordinary Shares),stocks,us,XNYS,ADRC,usd
2916,DRAI,Draco Evolution AI ETF,stocks,us,ARCX,ETF,usd
2917,DRAY,YieldMax DKNG Option Income Strategy ETF,stocks,us,ARCX,ETS,usd
2918,DRCT,"Direct Digital Holdings, Inc. Class A Common Stock",stocks,us,XNAS,CS,usd
2919,DRD,DRDGOLD Ltd.,stocks,us,XNYS,ADRC,usd
2920,DRDB,Roman DBDR Acquisition Corp. II Ordinary shares,stocks,us,XNAS,CS,usd
2921,DRDBU,Roman DBDR Acquisition Corp. II Unit,stocks,us,XNAS,UNIT,usd
2922,DRDBW,Roman DBDR Acquisition Corp. II Warrants,stocks,us,XNAS,WARRANT,usd
2923,DRES,GMO Domestic Resilience ETF,stocks,us,ARCX,ETF,usd
2924,DRGN,Themes China Generative Artificial Intelligence ETF,stocks,us,BATS,ETF,usd
2925,DRH,DiamondRock Hospitality Company,stocks,us,XNYS,CS,usd
2926,DRHpA,DiamondRock Hospitality Company 8.250% Series A Cumulative Redeemable Preferred Stock,stocks,us,XNYS,PFD,usd
2927,DRI,"Darden Restaurants, Inc.",stocks,us,XNYS,CS,usd
2928,DRIO,DarioHealth Corp. Common Stock,stocks,us,XNAS,CS,usd
2929,DRIP,Direxion Daily S&P Oil & Gas Exp. & Prod. Bear 2X Shares,stocks,us,ARCX,ETF,usd
2930,DRIV,Global X Autonomous & Electric Vehicles ETF,stocks,us,XNAS,ETF,usd
2931,DRKY,VistaShares Target 15 DRUKMacro Distribution ETF,stocks,us,ARCX,ETF,usd
2932,DRLL,Strive U.S. Energy ETF,stocks,us,XNYS,ETF,usd
2933,DRMA,"Dermata Therapeutics, Inc. Common Stock",stocks,us,XNAS,CS,usd
2934,DRMAW,"Dermata Therapeutics, Inc. Warrant",stocks,us,XNAS,WARRANT,usd
2935,DRN,Direxion Daily Real Estate Bull 3X Shares,stocks,us,ARCX,ETF,usd
2936,DRS,"Leonardo DRS, Inc. Common Stock",stocks,us,XNAS,CS,usd
2937,DRSK,Aptus Defined Risk ETF,stocks,us,BATS,ETF,usd
2938,DRTS,Alpha Tau Medical Ltd. Ordinary Shares,stocks,us,XNAS,CS,usd
2939,DRTSW,Alpha Tau Medical Ltd. Warrant,stocks,us,XNAS,WARRANT,usd
2940,DRUG,Bright Minds Biosciences Inc. Common Stock,stocks,us,XNAS,CS,usd
2941,DRUP,GraniteShares Nasdaq Select Disruptors ETF,stocks,us,ARCX,ETF,usd
2942,DRV,Direxion Daily Real Estate Bear 3X Shares,stocks,us,ARCX,ETF,usd
2943,DRVN,Driven Brands Holdings Inc. Common Stock,stocks,us,XNAS,CS,usd
2944,DSCF,Discipline Fund ETF,stocks,us,BATS,ETF,usd
2945,DSEP,FT Vest U.S. Equity Deep Buffer ETF - September,stocks,us,BATS,ETF,usd
2946,DSGN,"Design Therapeutics, Inc. Common Stock",stocks,us,XNAS,CS,usd
2947,DSGR,"Distribution Solutions Group, Inc. Common Stock",stocks,us,XNAS,CS,usd
2948,DSGX,Descartes Systems Group Inc,stocks,us,XNAS,CS,usd
2949,DSI,iShares ESG MSCI KLD 400 ETF,stocks,us,ARCX,ETF,usd
2950,DSL,DOUBLELINE INCOME SOLUTIONS FUND,stocks,us,XNYS,FUND,usd
2951,DSM,"BNY Mellon Strategic Municipal Bond Fund, Inc.",stocks,us,XNYS,FUND,usd
2952,DSMC,Distillate Small/Mid Cash Flow ETF,stocks,us,XNYS,ETF,usd
2953,DSP,Viant Technology Inc. Class A Common Stock,stocks,us,XNAS,CS,usd
2954,DSPY,Tema S&P 500 Historical Weight ETF Strategy,stocks,us,ARCX,ETF,usd
2955,DSS,"DSS, Inc.",stocks,us,XASE,CS,usd
2956,DSTL,Distillate U.S. Fundamental Stability & Value ETF,stocks,us,ARCX,ETF,usd
2957,DSTX,Distillate International Fundamental Stability & Value ETF,stocks,us,XNYS,ETF,usd
2958,DSU,"Blackrock Debt Strategies Fund, Inc.",stocks,us,XNYS,FUND,usd
2959,DSWL,Deswell Industries Inc,stocks,us,XNAS,CS,usd
2960,DSX,"Diana Shipping, Inc.",stocks,us,XNYS,CS,usd
2961,DSX.WS,"Diana Shipping Inc. Warrants to Purchase Common Stock (expiring on or about December 14, 2026)",stocks,us,XNYS,WARRANT,usd
2962,DSXpB,"DIANA SHIPPING INC 8.875% Series B Cumulative Redeemable Perpetual Preferred Shares, $0.01 par value",stocks,us,XNYS,PFD,usd
2963,DSY,Big Tree Cloud Holdings Limited Ordinary Shares,stocks,us,XNAS,CS,usd
2964,DSYWW,Big Tree Cloud Holdings Limited Warrants,stocks,us,XNAS,WARRANT,usd
2965,DT,"Dynatrace, Inc.",stocks,us,XNYS,CS,usd
2966,DTAN,Sparkline International Intangible Value ETF,stocks,us,ARCX,ETF,usd
2967,DTB,DTE Energy Company 2020 Series G 4.375% Junior Subordinated Debentures due 2080,stocks,us,XNYS,SP,usd
2968,DTCK,Davis Commodities Limited Class A Ordinary Shares,stocks,us,XNAS,CS,usd
2969,DTCR,Global X Funds Global X Data Center & Digital Infrastructure ETF,stocks,us,XNAS,ETF,usd
2970,DTD,WisdomTree U.S. Total Dividend Fund,stocks,us,ARCX,ETF,usd
2971,DTE,DTE Energy Company,stocks,us,XNYS,CS,usd
2972,DTEC,ALPS Disruptive Technologies ETF,stocks,us,ARCX,ETF,usd
2973,DTF,DTF Tax-Free Income 2028 Term Fund Inc.,stocks,us,XNYS,FUND,usd
2974,DTG,DTE Energy Company 2021 Series E 4.375% Junior Subordinated Debentures,stocks,us,XNYS,SP,usd
2975,DTH,WisdomTree International High Dividend  Fund,stocks,us,ARCX,ETF,usd
2976,DTI,Drilling Tools International Corporation Common Stock,stocks,us,XNAS,CS,usd
2977,DTIL,"Precision BioSciences, Inc. Common Stock",stocks,us,XNAS,CS,usd
2978,DTK,DTE Energy Company 2025 Series H 6.25% Junior Subordinated Debentures due 2085,stocks,us,XNYS,SP,usd
2979,DTM,"DT Midstream, Inc.",stocks,us,XNYS,CS,usd
2980,DTRE,First Trust Alerian Disruptive Technology Real Estate ETF,stocks,us,ARCX,ETF,usd
2981,DTSQ,DT Cloud Star Acquisition Corporation Ordinary Shares,stocks,us,XNAS,CS,usd
2982,DTSQR,DT Cloud Star Acquisition Corporation Right,stocks,us,XNAS,RIGHT,usd
2983,DTSQU,DT Cloud Star Acquisition Corporation Units,stocks,us,XNAS,UNIT,usd
2984,DTSS,Datasea Inc. Common Stock,stocks,us,XNAS,CS,usd
2985,DTST,Data Storage Corporation Common Stock,stocks,us,XNAS,CS,usd
2986,DTSTW,Data Storage Corporation Warrant,stocks,us,XNAS,WARRANT,usd
2987,DTW,DTE Energy Company 2017 Series E 5.25% Junior Subordinated Debentures due 2077,stocks,us,XNYS,SP,usd
2988,DUBS,Aptus Large Cap Enhanced Yield ETF,stocks,us,BATS,ETF,usd
2989,DUG,ProShares UltraShort Energy,stocks,us,ARCX,ETF,usd
2990,DUHP,Dimensional US High Profitability ETF,stocks,us,ARCX,ETF,usd
2991,DUK,Duke Energy Corporation,stocks,us,XNYS,CS,usd
2992,DUKB,Duke Energy Corporation 5.625% Junior Subordinated Debentures due 2078,stocks,us,XNYS,SP,usd
2993,DUKH,Ocean Park High Income ETF,stocks,us,XNAS,ETF,usd
2994,DUKQ,Ocean Park Domestic ETF,stocks,us,ARCX,ETF,usd
2995,DUKX,Ocean Park International ETF,stocks,us,XNAS,ETF,usd
2996,DUKZ,Ocean Park Diversified Income ETF,stocks,us,ARCX,ETF,usd
2997,DUKpA,"Duke Energy Corporation Depositary Shares, each representing a 1/1,000th interest in a share of 5.75% Series A Cumulative Redeemable Perpetual Preferred Stock",stocks,us,XNYS,PFD,usd
2998,DULL,MicroSectors Gold -3x Inverse Leveraged ETN,stocks,us,ARCX,ETS,usd
2999,DUNK,Dana Unconstrained Equity ETF,stocks,us,ARCX,ETF,usd
3000,DUO,Fangdd Network Group Ltd. Class A Ordinary Shares,stocks,us,XNAS,CS,usd
3001,DUOL,"Duolingo, Inc. Class A Common Stock",stocks,us,XNAS,CS,usd
3002,DUOT,"Duos Technologies Group, Inc. Common Stock",stocks,us,XNAS,CS,usd
3003,DURA,VanEck Durable High Dividend ETF,stocks,us,BATS,ETF,usd
3004,DUSA,Davis Select U.S. Equity ETF,stocks,us,BATS,ETF,usd
3005,DUSB,Dimensional Ultrashort Fixed Income ETF,stocks,us,ARCX,ETF,usd
3006,DUSL,Direxion Daily Industrials Bull 3X Shares,stocks,us,ARCX,ETF,usd
3007,DUST,Direxion Daily Gold Miners Index Bear 2X Shares,stocks,us,ARCX,ETF,usd
3008,DV,"DoubleVerify Holdings, Inc.",stocks,us,XNYS,CS,usd
3009,DVA,DaVita Inc.,stocks,us,XNYS,CS,usd
3010,DVAL,BrandywineGLOBAL - Dynamic US Large Cap Value ETF,stocks,us,XNAS,ETF,usd
3011,DVAX,Dynavax Technologies Corporation,stocks,us,XNAS,CS,usd
3012,DVDN,Kingsbarn Dividend Opportunity ETF,stocks,us,ARCX,ETF,usd
3013,DVIN,WEBs Defined Volatility XLI ETF,stocks,us,XNAS,ETF,usd
3014,DVLT,Datavault AI Inc. Common Stock,stocks,us,XNAS,CS,usd
3015,DVLU,First Trust Dorsey Wright Momentum & Value ETF,stocks,us,XNAS,ETF,usd
3016,DVN,Devon Energy Corporation,stocks,us,XNYS,CS,usd
3017,DVND,Touchstone Dividend Select ETF,stocks,us,ARCX,ETF,usd
3018,DVOL,First Trust Dorsey Wright Momentum & Low Volatility ETF,stocks,us,XNAS,ETF,usd
3019,DVQQ,WEBs Defined Volatility QQQ ETF,stocks,us,XNAS,ETF,usd
3020,DVRE,WEBs Defined Volatility XLRE ETF,stocks,us,XNAS,ETF,usd
3021,DVS,Dolly Varden Silver Corporation,stocks,us,XASE,CS,usd
3022,DVSP,WEBs Defined Volatility SPY ETF,stocks,us,XNAS,ETF,usd
3023,DVUT,WEBS Defined Volatility XLU ETF,stocks,us,XNAS,ETF,usd
3024,DVXB,WEBs Defined Volatility XLB ETF,stocks,us,XNAS,ETF,usd
3025,DVXC,WEBs Defined Volatility XLC ETF,stocks,us,XNAS,ETF,usd
3026,DVXE,WEBs Defined Volatility XLE ETF,stocks,us,XNAS,ETF,usd
3027,DVXF,WEBs Defined Volatility XLF ETF,stocks,us,XNAS,ETF,usd
3028,DVXK,WEBs Defined Volatility XLK ETF,stocks,us,XNAS,ETF,usd
3029,DVXP,WEBs Defined Volatility XLP ETF,stocks,us,XNAS,ETF,usd
3030,DVXV,WEBs Defined Volatility XLV ETF,stocks,us,XNAS,ETF,usd
3031,DVXY,WEBs Defined Volatility XLY ETF,stocks,us,XNAS,ETF,usd
3032,DVY,iShares Select Dividend ETF,stocks,us,XNAS,ETF,usd
3033,DVYA,iShares Asia/Pacific Dividend ETF,stocks,us,ARCX,ETF,usd
3034,DVYE,iShares Emerging Markets Dividend ETF,stocks,us,ARCX,ETF,usd
3035,DWAS,Invesco Exchange-Traded Fund Trust II Invesco Dorsey Wright SmallCap Momentum ETF,stocks,us,XNAS,ETF,usd
3036,DWAW,AdvisorShares Dorsey Wright FSM All Cap World ETF,stocks,us,XNAS,ETF,usd
3037,DWLD,Davis Select Worldwide ETF,stocks,us,BATS,ETF,usd
3038,DWM,WisdomTree International Equity Fund,stocks,us,ARCX,ETF,usd
3039,DWMF,WisdomTree International Multifactor Fund,stocks,us,ARCX,ETF,usd
3040,DWSH,AdvisorShares Dorsey Wright Short ETF,stocks,us,XNAS,ETF,usd
3041,DWSN,Dawson Geophysical Company New Common Stock,stocks,us,XNAS,CS,usd
3042,DWTX,"Dogwood Therapeutics, Inc. Common Stock",stocks,us,XNAS,CS,usd
3043,DWUS,AdvisorShares Dorsey Wright FSM US Core ETF,stocks,us,XNAS,ETF,usd
3044,DWX,SPDR S&P International Dividend ETF,stocks,us,ARCX,ETF,usd
3045,DX,"Dynex Capital, Inc.",stocks,us,XNYS,CS,usd
3046,DXC,DXC Technology Company,stocks,us,XNYS,CS,usd
3047,DXCM,"DexCom, Inc.",stocks,us,XNAS,CS,usd
3048,DXD,ProShares UltraShort Dow 30,stocks,us,ARCX,ETF,usd
3049,DXF,"Eason Technology Limited American Depositary Shares (each representing sixty-thousand (60,000) Ordinary Shares)",stocks,us,XASE,ADRC,usd
3050,DXIV,Dimensional International Vector Equity ETF,stocks,us,ARCX,ETF,usd
3051,DXJ,WisdomTree Japan Hedged Equity Fund,stocks,us,ARCX,ETF,usd
3052,DXLG,"Destination XL Group, Inc. Common Stock",stocks,us,XNAS,CS,usd
3053,DXPE,DXP Enterprises Inc,stocks,us,XNAS,CS,usd
3054,DXR,Daxor Corporation Common Stock,stocks,us,XNAS,CS,usd
3055,DXST,Decent Holding Inc Class A Ordinary Shares,stocks,us,XNAS,CS,usd
3056,DXUV,Dimensional US Vector Equity ETF,stocks,us,ARCX,ETF,usd
3057,DXYZ,Destiny Tech100 Inc.,stocks,us,XNYS,CS,usd
3058,DXpC,"Dynex Capital, Inc. 6.900% Series C Fixed-to-Floating Rate Cumulative Redeemable Preferred Stock",stocks,us,XNYS,PFD,usd
3059,DY,"Dycom Industries, Inc.",stocks,us,XNYS,CS,usd
3060,DYAI,"Dyadic International, Inc.",stocks,us,XNAS,CS,usd
3061,DYCQ,DT Cloud Acquisition Corporation Ordinary Shares,stocks,us,XNAS,CS,usd
3062,DYCQR,DT Cloud Acquisition Corporation Right,stocks,us,XNAS,RIGHT,usd
3063,DYCQU,DT Cloud Acquisition Corporation Unit,stocks,us,XNAS,UNIT,usd
3064,DYFI,IDX Dynamic Fixed Income ETF,stocks,us,XNAS,ETF,usd
3065,DYLD,LeaderShares Dynamic Yield ETF,stocks,us,ARCX,ETF,usd
3066,DYLG,Global X Dow 30Covered Call & Growth ETF,stocks,us,ARCX,ETF,usd
3067,DYN,"Dyne Therapeutics, Inc. Common Stock",stocks,us,XNAS,CS,usd
3068,DYNB,Hartford Dynamic Bond ETF,stocks,us,XNAS,ETF,usd
3069,DYNF,iShares U.S. Equity Factor Rotation Active ETF,stocks,us,ARCX,ETF,usd
3070,DYTA,SGI Dynamic Tactical ETF,stocks,us,XNAS,ETF,usd
3071,DZZ,"DB Gold Double Short ETN due February 15, 2038",stocks,us,ARCX,ETN,usd
3072,E,ENI S.p.A.,stocks,us,XNYS,ADRC,usd
3073,EA,Electronic Arts Inc,stocks,us,XNAS,CS,usd
3074,EAD,Allspring Income Opportunities Fund,stocks,us,XASE,FUND,usd
3075,EAF,GrafTech International Ltd.,stocks,us,XNYS,CS,usd
3076,EAFG,Pacer Developed Markets Cash Cows Growth Leaders ETF,stocks,us,ARCX,ETF,usd
3077,EAGG,iShares ESG Aware U.S. Aggregate Bond ETF,stocks,us,ARCX,ETF,usd
3078,EAGL,Eagle Capital Select Equity ETF,stocks,us,ARCX,ETF,usd
3079,EAI,"Entergy Arkansas, LLC First Mortgage Bonds, 4.875% Series due September 1, 2066",stocks,us,XNYS,SP,usd
3080,EALT,Innovator U.S. Equity 5 to 15 Buffer ETF - Quarterly,stocks,us,BATS,ETF,usd
3081,EAOA,iShares ESG Aware 80/20 Aggressive Allocation ETF,stocks,us,BATS,ETF,usd
3082,EAOK,iShares ESG Aware 30/70 Conservative Allocation ETF,stocks,us,BATS,ETF,usd
3083,EAOM,iShares ESG Aware 40/60 Moderate Allocation ETF,stocks,us,BATS,ETF,usd
3084,EAOR,iShares ESG Aware 60/40 Balanced Allocation ETF,stocks,us,BATS,ETF,usd
3085,EAPR,Innovator Emerging Markets Power Buffer ETF - April,stocks,us,ARCX,ETS,usd
3086,EARN,Ellington Credit Company,stocks,us,XNYS,CS,usd
3087,EASG,Xtrackers MSCI EAFE Selection Equity ETF,stocks,us,ARCX,ETF,usd
3088,EASY,Liberty One Defensive Dividend Growth ETF,stocks,us,XNAS,ETF,usd
3089,EAT,"Brinker International, Inc.",stocks,us,XNYS,CS,usd
3090,EATZ,AdvisorShares Restaurant ETF,stocks,us,ARCX,ETF,usd
3091,EB,"Eventbrite, Inc. Class A Common Stock",stocks,us,XNYS,CS,usd
3092,EBAY,eBay Inc,stocks,us,XNAS,CS,usd
3093,EBC,"Eastern Bankshares, Inc. Common Stock",stocks,us,XNAS,CS,usd
3094,EBF,"Ennis, Inc.",stocks,us,XNYS,CS,usd
3095,EBI,The RBB Fund Trust Longview Advantage ETF,stocks,us,XNAS,ETF,usd
3096,EBIT,Harbor AlphaEdge Small Cap Earners ETF,stocks,us,ARCX,ETF,usd
3097,EBIZ,Global X E-commerce ETF,stocks,us,XNAS,ETF,usd
3098,EBMT,"Eagle Bancorp Montana, Inc",stocks,us,XNAS,CS,usd
3099,EBND,SPDR Bloomberg Emerging Markets Local Bond ETF,stocks,us,ARCX,ETF,usd
3100,EBON,Ebang International Holdings Inc. Class A Ordinary Shares,stocks,us,XNAS,CS,usd
3101,EBR,Centrais Eltricas Brasileiras S.A.- Eletrobrs American Depositary Shares (Each representing one Common Share),stocks,us,XNYS,ADRC,usd
3102,EBR.B,Centrais Eltricas Brasileiras S.A.- Eletrobrs American Depositary Shares (Each representing one Preferred Share),stocks,us,XNYS,ADRC,usd
3103,EBS,"Emergent Biosolutions, Inc.",stocks,us,XNYS,CS,usd
3104,EBUF,Innovator Emerging Markets 10 Buffer ETF - Quarterly,stocks,us,ARCX,ETS,usd
3105,EC,Ecopetrol S.A,stocks,us,XNYS,ADRC,usd
3106,ECAT,BlackRock ESG Capital Allocation Term Trust,stocks,us,XNYS,FUND,usd
3107,ECBK,"ECB Bancorp, Inc. Common Stock",stocks,us,XNAS,CS,usd
3108,ECC,EAGLE POINT CREDIT COMPANY INC.,stocks,us,XNYS,FUND,usd
3109,ECCC,Eagle Point Credit Company Inc. 6.50% Series C Term Preferred Stock due 2031,stocks,us,XNYS,SP,usd
3110,ECCF,Eagle Point Credit Company Inc. 8.00% Series F Term Preferred Stock due 2029,stocks,us,XNYS,SP,usd
3111,ECCU,Eagle Point Credit Company Inc. 7.75% Notes due 2030,stocks,us,XNYS,SP,usd
3112,ECCV,Eagle Point Credit Company Inc. 5.375% Notes due 2029,stocks,us,XNYS,SP,usd
3113,ECCW,Eagle Point Credit Company Inc .6.75% Notes due 2031,stocks,us,XNYS,SP,usd
3114,ECCX,Eagle Point Credit Company Inc. 6.6875% Notes due 2028,stocks,us,XNYS,SP,usd
3115,ECCpD,Eagle Point Credit Company Inc. 6.75% Series D Preferred Stock,stocks,us,XNYS,PFD,usd
3116,ECDA,"ECD Automotive Design, Inc. Common Stock",stocks,us,XNAS,CS,usd
3117,ECDAW,"ECD Automotive Design, Inc. Warrant",stocks,us,XNAS,WARRANT,usd
3118,ECF,Ellsworth Growth and Income Fund Ltd,stocks,us,XASE,FUND,usd
3119,ECFpA,Ellsworth Growth and Income Fund Ltd. 5.25 percent Series A Cumulative Preferred Shares (Liquidation Preference $25.00 per share),stocks,us,XASE,PFD,usd
3120,ECG,"Everus Construction Group, Inc.",stocks,us,XNYS,CS,usd
3121,ECH,iShares MSCI Chile ETF,stocks,us,BATS,ETF,usd
3122,ECL,"Ecolab, Inc.",stocks,us,XNYS,CS,usd
3123,ECML,Euclidean Fundamental Value ETF,stocks,us,ARCX,ETF,usd
3124,ECNS,iShares MSCI China Small-Cap ETF,stocks,us,ARCX,ETF,usd
3125,ECO,Okeanis Eco Tankers Corp.,stocks,us,XNYS,CS,usd
3126,ECON,Columbia Research Enhanced Emerging Economies ETF,stocks,us,ARCX,ETF,usd
3127,ECOR,"electroCore, Inc. Common Stock",stocks,us,XNAS,CS,usd
3128,ECOW,Pacer Emerging Markets Cash Cows 100 ETF,stocks,us,XNAS,ETF,usd
3129,ECPG,"Encore Capital Group, Inc.",stocks,us,XNAS,CS,usd
3130,ECVT,Ecovyst Inc.,stocks,us,XNYS,CS,usd
3131,ECX,ECARX Holdings Inc. Class A Ordinary shares,stocks,us,XNAS,CS,usd
3132,ECXWW,ECARX Holdings Inc. Warrants,stocks,us,XNAS,WARRANT,usd
3133,ED,"Consolidated Edison, Inc.",stocks,us,XNYS,CS,usd
3134,EDAP,EDAP TMS SA,stocks,us,XNAS,ADRC,usd
3135,EDBL,Edible Garden AG Incorporated Common Stock,stocks,us,XNAS,CS,usd
3136,EDBLW,Edible Garden AG Incorporated Warrant,stocks,us,XNAS,WARRANT,usd
3137,EDC,"Direxion Daily Emerging Markets Bull 3X Shares, Shares of beneficial interest, no par value",stocks,us,ARCX,ETF,usd
3138,EDD,"Morgan Stanley Emerging Markets Domestic Debt Fund, Inc.",stocks,us,XNYS,FUND,usd
3139,EDEN,iShares MSCI Denmark ETF,stocks,us,BATS,ETF,usd
3140,EDF,Virtus Stone Harbor Emerging Markets Income Fund,stocks,us,XNYS,FUND,usd
3141,EDGE,MRBL Enhanced Equity ETF,stocks,us,BATS,ETF,usd
3142,EDGF,3EDGE Dynamic Fixed Income ETF,stocks,us,ARCX,ETF,usd
3143,EDGH,3EDGE Dynamic Hard Assets ETF,stocks,us,ARCX,ETF,usd
3144,EDGI,3EDGE Dynamic International Equity ETF,stocks,us,ARCX,ETF,usd
3145,EDGU,3EDGE Dynamic US Equity ETF,stocks,us,ARCX,ETF,usd
3146,EDHL,Everbright Digital Holding Limited Ordinary Shares,stocks,us,XNAS,CS,usd
3147,EDIT,"Editas Medicine, Inc. Common Stock",stocks,us,XNAS,CS,usd
3148,EDIV,SPDR S&P Emerging Markets Dividend ETF,stocks,us,ARCX,ETF,usd
3149,EDN,Empresa Distribuidora Y Comercializadora Norte S.A. (Edenor),stocks,us,XNYS,ADRC,usd
3150,EDOG,ALPS Emerging Sector Dividend Dogs ETF,stocks,us,ARCX,ETF,usd
3151,EDOW,First Trust Dow 30 Equal Weight ETF,stocks,us,ARCX,ETF,usd
3152,EDRY,EuroDry Ltd. Common Shares,stocks,us,XNAS,CS,usd
3153,EDSA,"Edesa Biotech, Inc. Common Shares",stocks,us,XNAS,CS,usd
3154,EDTK,Skillful Craftsman Education Technology Limited Ordinary Share,stocks,us,XNAS,CS,usd
3155,EDU,"New Oriental Education and Technology Group, Inc. American Depositary Shares (each representing ten (10) Common Shares)",stocks,us,XNYS,ADRC,usd
3156,EDUC,Educational Development Corp,stocks,us,XNAS,CS,usd
3157,EDV,Vanguard World Funds Extended Duration ETF,stocks,us,ARCX,ETF,usd
3158,EDZ,Direxion Daily Emerging Markets Bear 3x Shares,stocks,us,ARCX,ETF,usd
3159,EE,"Excelerate Energy, Inc.",stocks,us,XNYS,CS,usd
3160,EEA,"The European Equity Fund, Inc.",stocks,us,XNYS,FUND,usd
3161,EEFT,Euronet Worldwide Inc,stocks,us,XNAS,CS,usd
3162,EEIQ,EpicQuest Education Group International Limited Common Stock,stocks,us,XNAS,CS,usd
3163,EELV,Invesco S&P Emerging Markets Low Volatility ETF,stocks,us,ARCX,ETF,usd
3164,EEM,iShares MSCI Emerging Markets ETF,stocks,us,ARCX,ETF,usd
3165,EEMA,iShares MSCI Emerging Markets Asia ETF,stocks,us,XNAS,ETF,usd
3166,EEMO,Invesco S&P Emerging Markets Momentum ETF,stocks,us,ARCX,ETF,usd
3167,EEMS,iShares MSCI Emerging Markets Small-Cap ETF,stocks,us,ARCX,ETF,usd
3168,EEMV,iShares MSCI Emerging Markets Min Vol Factor ETF,stocks,us,BATS,ETF,usd
3169,EEMX,SPDR MSCI Emerging Markets Fossil Fuel Reserves Free ETF,stocks,us,ARCX,ETF,usd
3170,EES,WisdomTree U.S. SmallCap Fund,stocks,us,ARCX,ETF,usd
3171,EET,ProShares Ultra MSCI Emerging Markets,stocks,us,ARCX,ETF,usd
3172,EETH,ProShares Ether ETF,stocks,us,ARCX,ETF,usd
3173,EEV,ProShares Trust UltraShort MSCI Emerging Markets,stocks,us,ARCX,ETF,usd
3174,EEX,"Emerald Holding, Inc.",stocks,us,XNYS,CS,usd
3175,EFA,iShares MSCI EAFE ETF,stocks,us,ARCX,ETF,usd
3176,EFAA,Invesco MSCI EAFE Income Advantage ETF,stocks,us,ARCX,ETF,usd
3177,EFAD,ProShares MSCI EAFE Dividend Growers ETF,stocks,us,BATS,ETF,usd
3178,EFAS,Global X MSCI SuperDividend EAFE ETF,stocks,us,XNAS,ETF,usd
3179,EFAV,iShares MSCI EAFE Min Vol Factor ETF,stocks,us,BATS,ETF,usd
3180,EFAX,SPDR MSCI EAFE Fossil Fuel Reserves Free ETF,stocks,us,ARCX,ETF,usd
3181,EFC,Ellington Financial Inc. Common Stock,stocks,us,XNYS,CS,usd
3182,EFCpA,Ellington Financial Inc. 6.750% Series A Fixed-to-Floating Rate Cumulative Redeemable Preferred Stock,stocks,us,XNYS,PFD,usd
3183,EFCpB,Ellington Financial Inc. 6.250% Series B Fixed-Rate Reset Cumulative Redeemable Preferred Stock,stocks,us,XNYS,PFD,usd
3184,EFCpC,Ellington Financial Inc. 8.625% Series C Fixed-Rate Reset Cumulative Redeemable Preferred Stock,stocks,us,XNYS,PFD,usd
3185,EFCpD,Ellington Financial Inc. 7.00% Series D Cumulative Perpetual Redeemable Preferred Stock,stocks,us,XNYS,PFD,usd
3186,EFFE,Harbor Osmosis Emerging Markets Resource Efficient ETF,stocks,us,ARCX,ETF,usd
3187,EFFI,Harbor Osmosis International Resource Efficient ETF,stocks,us,ARCX,ETF,usd
3188,EFG,iShares MSCI EAFE Growth ETF,stocks,us,BATS,ETF,usd
3189,EFIV,SPDR S&P 500 ESG ETF,stocks,us,ARCX,ETF,usd
3190,EFNL,iShares MSCI Finland ETF,stocks,us,BATS,ETF,usd
3191,EFO,ProShares Ultra MSCI EAFE,stocks,us,ARCX,ETF,usd
3192,EFOI,"Energy Focus, Inc.",stocks,us,XNAS,CS,usd
3193,EFR,Eaton Vance Senior Floating-Rate Fund,stocks,us,XNYS,FUND,usd
3194,EFRA,iShares Environmental Infrastructure and Industrials ETF,stocks,us,XNAS,ETF,usd
3195,EFSC,Enterprise Financial Services Corporation,stocks,us,XNAS,CS,usd
