1,A,Agilent Technologies Inc.,stocks,us,XNYS,CS,usd
5711,IZEA,"IZEA Worldwide, Inc. Common Stock",stocks,us,XNAS,CS,usd
5712,IZM,ICZOOM Group Inc. Class A Ordinary Shares,stocks,us,XNAS,CS,usd
5713,IZRL,ARK Israel Innovative Technology ETF,stocks,us,BATS,ETF,usd
5714,J,Jacobs Solutions Inc.,stocks,us,XNYS,CS,usd
5715,JAAA,Janus Henderson AAA CLO ETF,stocks,us,ARCX,ETF,usd
5716,JABS,Janus Henderson Asset-Backed Securities ETF,stocks,us,ARCX,ETF,usd
5717,JACK,Jack in the Box Inc.,stocks,us,XNAS,CS,usd
5718,JACS,Jackson Acquisition Company II,stocks,us,XNYS,CS,usd
5719,JACS.U,"Jackson Acquisition Company II Units, each consisting of one Class A ordinary share and one right to acquire one-tenth (1/10) of one Class A ordinary share",stocks,us,XNYS,UNIT,usd
5720,JACSr,"Jackson Acquisition Company II Rights, each right to acquire one-tenth (1/10) of one Class A ordinary share",stocks,us,XNYS,RIGHT,usd
5721,JADE,JPMorgan Active Developing Markets Equity ETF,stocks,us,ARCX,ETF,usd
5722,JAGX,"Jaguar Health, Inc.",stocks,us,XNAS,CS,usd
5723,JAJL,Innovator Equity Defined Protection ETF - 6mo Jan/Jul,stocks,us,BATS,ETF,usd
5724,JAKK,Jakks Pacific Inc,stocks,us,XNAS,CS,usd
5725,JAMF,Jamf Holding Corp. Common Stock,stocks,us,XNAS,CS,usd
5726,JANB,Aptus January Buffer ETF,stocks,us,BATS,ETF,usd
5727,JANH,Innovator Premium Income 20 Barrier ETF - January,stocks,us,BATS,ETF,usd
5728,JANJ,Innovator Premium Income 30 Barrier ETF - January,stocks,us,BATS,ETF,usd
5729,JANM,FT U.S. Equity Max Buffer ETF - January,stocks,us,BATS,ETF,usd
5730,JANP,PGIM S&P 500 Buffer 12 ETF - January,stocks,us,BATS,ETF,usd
5731,JANT,AllianzIM U.S. Large Cap Buffer10 Jan ETF,stocks,us,ARCX,ETS,usd
5732,JANU,AllianzIM U.S. Equity Buffer15 Uncapped Jan ETF,stocks,us,BATS,ETF,usd
5733,JANW,AllianzIM U.S. Large Cap Buffer20 Jan ETF,stocks,us,ARCX,ETS,usd
5734,JANX,"Janux Therapeutics, Inc. Common Stock",stocks,us,XNAS,CS,usd
5735,JANZ,TrueShares Structured Outcome (January) ETF,stocks,us,BATS,ETF,usd
5736,JAPN,Horizon Kinetics Japan Owner Operator ETF,stocks,us,XNAS,ETF,usd
5737,JAVA,JPMorgan Active Value ETF,stocks,us,ARCX,ETF,usd
5738,JAZZ,"Jazz Pharmaceuticals, Inc.",stocks,us,XNAS,CS,usd
5739,JBBB,Janus Henderson B-BBB CLO ETF,stocks,us,BATS,ETF,usd
5740,JBDI,JBDI Holdings Limited Ordinary Shares,stocks,us,XNAS,CS,usd
5741,JBGS,JBG SMITH Properties Common Shares,stocks,us,XNYS,CS,usd
5742,JBHT,JB Hunt Transport Services Inc,stocks,us,XNAS,CS,usd
5743,JBI,"Janus International Group, Inc.",stocks,us,XNYS,CS,usd
5744,JBIO,"Jade Biosciences, Inc. Common Stock",stocks,us,XNAS,CS,usd
5745,JBK,Lehman ABS Corp 3.50 Adj Corp Backed Tr Cert Goldman Cap I,stocks,us,XNYS,SP,usd
5746,JBL,Jabil Inc.,stocks,us,XNYS,CS,usd
5747,JBLU,JetBlue Airways Corp,stocks,us,XNAS,CS,usd
5748,JBND,JPMorgan Active Bond ETF,stocks,us,XNYS,ETF,usd
5749,JBS,JBS N.V.,stocks,us,XNYS,CS,usd
5750,JBSS,John B. Sanfilippo & SON,stocks,us,XNAS,CS,usd
5751,JBTM,JBT Marel Corporation,stocks,us,XNYS,CS,usd
5752,JCAP,"Jefferson Capital, Inc. Common Stock",stocks,us,XNAS,CS,usd
5753,JCE,Nuveen Core Equity Alpha Fund,stocks,us,XNYS,FUND,usd
5754,JCHI,JPMorgan Active China ETF,stocks,us,ARCX,ETF,usd
5755,JCI,Johnson Controls International plc,stocks,us,XNYS,CS,usd
5756,JCPB,JPMorgan Core Plus Bond ETF,stocks,us,BATS,ETF,usd
5757,JCPI,JPMorgan Inflation Managed Bond ETF,stocks,us,BATS,ETF,usd
5758,JCSE,JE Cleantech Holdings Limited Ordinary Shares,stocks,us,XNAS,CS,usd
5759,JCTC,Jewett-Cameron Trading,stocks,us,XNAS,CS,usd
5760,JD,"JD.com, Inc.",stocks,us,XNAS,ADRC,usd
5761,JDIV,JPMorgan Dividend Leaders ETF,stocks,us,ARCX,ETF,usd
5762,JDOC,JPMorgan Healthcare Leaders ETF,stocks,us,XNAS,ETF,usd
5763,JDST,Direxion Daily Junior Gold Miners Index Bear 2X Shares,stocks,us,ARCX,ETF,usd
5764,JDVI,John Hancock Disciplined Value International Select ETF,stocks,us,ARCX,ETF,usd
5765,JDVL,John Hancock Disciplined Value Select ETF,stocks,us,ARCX,ETF,usd
5766,JDZG,JIADE LIMITED Class A Ordinary Shares,stocks,us,XNAS,CS,usd
5767,JEDI,Defiance Drone and Modern Warfare ETF,stocks,us,ARCX,ETF,usd
5768,JEF,Jefferies Financial Group Inc.,stocks,us,XNYS,CS,usd
5769,JELD,"JELD-WEN Holding, Inc.",stocks,us,XNYS,CS,usd
5770,JEM,707 Cayman Holdings Limited Ordinary Shares,stocks,us,XNAS,CS,usd
5771,JEMA,JPMorgan ActiveBuilders Emerging Markets Equity ETF,stocks,us,BATS,ETF,usd
5772,JEMB,Janus Henderson Emerging Markets Debt Hard Currency ETF,stocks,us,ARCX,ETF,usd
5773,JENA,Jena Acquisition Corporation II,stocks,us,XNYS,CS,usd
5774,JENA.U,"Jena Acquisition Corporation II Units, each consisting of one Class A ordinary share and one right",stocks,us,XNYS,UNIT,usd
5775,JENAr,"Jena Acquisition Corporation II Rights, each right to acquire one-twentieth (1/20) of one Class A ordinary share",stocks,us,XNYS,RIGHT,usd
5776,JEPI,JPMorgan Equity Premium Income ETF,stocks,us,ARCX,ETF,usd
5777,JEPQ,J.P. Morgan Nasdaq Equity Premium Income ETF,stocks,us,XNAS,ETF,usd
5778,JETD,MAX Airlines -3x Inverse Leveraged ETN,stocks,us,ARCX,ETN,usd
5779,JETS,U.S. Global Jets ETF,stocks,us,ARCX,ETF,usd
5780,JETU,MAX Airlines 3x Leveraged ETN,stocks,us,ARCX,ETN,usd
5781,JFB,JFB Construction Holdings Class A Common Stock,stocks,us,XNAS,CS,usd
5782,JFBR,Jeffs' Brands Ltd Ordinary Shares,stocks,us,XNAS,CS,usd
5783,JFBRW,Jeffs' Brands Ltd Warrant,stocks,us,XNAS,WARRANT,usd
5784,JFIN,Jiayin Group Inc. American Depositary Shares,stocks,us,XNAS,ADRC,usd
5785,JFLI,JPMorgan Flexible Income ETF,stocks,us,ARCX,ETF,usd
5786,JFLX,JPMorgan Flexible Debt ETF,stocks,us,ARCX,ETF,usd
5787,JFR,Nuveen Floating Rate Income Fund,stocks,us,XNYS,FUND,usd
5788,JFU,9F Inc. American Depositary Shares,stocks,us,XNAS,ADRC,usd
5789,JG,Aurora Mobile Limited American Depositary Shares,stocks,us,XNAS,ADRC,usd
5790,JGH,NUVEEN GLOBAL HIGH INCOME FUND,stocks,us,XNYS,FUND,usd
5791,JGHrw,"Nuveen Global High Income Fund Rights (expiring November 20, 2025)",stocks,us,XNYS,RIGHT,usd
5792,JGLO,JPMorgan Global Select Equity ETF,stocks,us,XNAS,ETF,usd
5793,JGRO,JPMorgan Active Growth ETF,stocks,us,ARCX,ETF,usd
5794,JGRW,Jensen Quality Growth ETF,stocks,us,ARCX,ETF,usd
5795,JHAC,John Hancock Fundamental All Cap Core ETF,stocks,us,ARCX,ETF,usd
5796,JHAI,Janus Henderson Global Artificial Intelligence ETF,stocks,us,XNAS,ETF,usd
5797,JHCB,John Hancock Corporate Bond ETF,stocks,us,ARCX,ETF,usd
5798,JHCP,John Hancock Core Plus Bond ETF,stocks,us,ARCX,ETF,usd
5799,JHCR,John Hancock Core Bond ETF,stocks,us,ARCX,ETF,usd
5800,JHDV,John Hancock U.S. High Dividend ETF,stocks,us,ARCX,ETF,usd
5801,JHEM,John Hancock Multifactor Emerging Markets ETF,stocks,us,ARCX,ETF,usd
5802,JHG,Janus Henderson Group plc Ordinary Shares,stocks,us,XNYS,CS,usd
5803,JHHY,John Hancock High Yield ETF,stocks,us,ARCX,ETF,usd
5804,JHI,John Hancock Investors Trust Capital Stock,stocks,us,XNYS,FUND,usd
5805,JHID,John Hancock International High Dividend ETF,stocks,us,ARCX,ETF,usd
5806,JHLN,John Hancock Global Senior Loan ETF,stocks,us,ARCX,ETF,usd
5807,JHMB,John Hancock Mortgage-Backed Securities ETF,stocks,us,ARCX,ETF,usd
5808,JHMD,John Hancock Multifactor Developed International ETF,stocks,us,ARCX,ETF,usd
5809,JHML,John Hancock Multifactor Large Cap ETF,stocks,us,ARCX,ETF,usd
5810,JHMM,John Hancock Multifactor Mid Cap ETF,stocks,us,ARCX,ETF,usd
5811,JHMU,John Hancock Dynamic Municipal Bond ETF,stocks,us,ARCX,ETF,usd
5812,JHPI,John Hancock Preferred Income ETF,stocks,us,ARCX,ETF,usd
5813,JHS,John Hancock Income Securities Trust Capital Stock,stocks,us,XNYS,FUND,usd
5814,JHSC,John Hancock Multifactor Small Cap ETF,stocks,us,ARCX,ETF,usd
5815,JHX,James Hardie Industries plc,stocks,us,XNYS,CS,usd
5816,JIG,JPMorgan International Growth ETF,stocks,us,ARCX,ETF,usd
5817,JIII,Janus Henderson Income ETF,stocks,us,ARCX,ETF,usd
5818,JILL,"J.Jill, Inc. Common Stock",stocks,us,XNYS,CS,usd
5819,JIRE,JPMorgan International Research Enhanced Equity ETF,stocks,us,ARCX,ETF,usd
5820,JIVE,JPMorgan International Value ETF,stocks,us,XNAS,ETF,usd
5821,JJSF,J&J Snack Foods Corp,stocks,us,XNAS,CS,usd
5822,JKHY,Henry (Jack) & Associates,stocks,us,XNAS,CS,usd
5823,JKS,JINKOSOLAR HOLDINGS CO,stocks,us,XNYS,ADRC,usd
5824,JL,J-Long Group Limited Class A Ordinary Shares,stocks,us,XNAS,CS,usd
5825,JLHL,Julong Holding Limited Class A Ordinary Shares,stocks,us,XNAS,CS,usd
5826,JLL,"Jones Lang LaSalle, Inc.",stocks,us,XNYS,CS,usd
5827,JLQD,Janus Henderson Corporate Bond ETF,stocks,us,ARCX,ETF,usd
5828,JLS,Nuveen Mortgage and Income Fund,stocks,us,XNYS,FUND,usd
5829,JMBS,Janus Henderson Mortgage-Backed Securities ETF,stocks,us,ARCX,ETF,usd
5830,JMEE,JPMorgan Small & Mid Cap Enhanced Equity ETF,stocks,us,ARCX,ETF,usd
5831,JMHI,JPMorgan High Yield Municipal ETF,stocks,us,ARCX,ETF,usd
5832,JMIA,Jumia Technologies AG,stocks,us,XNYS,ADRC,usd
5833,JMID,Janus Henderson Mid Cap Growth Alpha ETF,stocks,us,XNAS,ETF,usd
5834,JMM,"NUVEEN MULTI-MARKET INCOME FUND, INC",stocks,us,XNYS,FUND,usd
5835,JMOM,JPMorgan U.S. Momentum Factor ETF,stocks,us,ARCX,ETF,usd
5836,JMSB,"John Marshall Bancorp, Inc. Common Stock",stocks,us,XNAS,CS,usd
5837,JMSI,JPMorgan Sustainable Municipal Income ETF,stocks,us,ARCX,ETF,usd
5838,JMST,JPMorgan Ultra-Short Municipal Income ETF,stocks,us,BATS,ETF,usd
5839,JMTG,JPMorgan Mortgage-Backed Securities ETF,stocks,us,ARCX,ETF,usd
5840,JMUB,JPMorgan Municipal ETF,stocks,us,BATS,ETF,usd
5841,JNEU,AllianzIM U.S. Equity Buffer15 Uncapped June ETF,stocks,us,BATS,ETF,usd
5842,JNJ,Johnson & Johnson,stocks,us,XNYS,CS,usd
5843,JNK,SPDR Bloomberg High Yield Bond ETF,stocks,us,ARCX,ETF,usd
5844,JNUG,Direxion Daily Junior Gold Miners Index Bull 2X Shares,stocks,us,ARCX,ETF,usd
5845,JOB,GEE Group Inc.,stocks,us,XASE,CS,usd
5846,JOBX,Tradr 2X Long JOBY Daily ETF,stocks,us,BATS,ETF,usd
5847,JOBY,"Joby Aviation, Inc.",stocks,us,XNYS,CS,usd
5848,JOBY.WS,"Joby Aviation, Inc.  Redeemable Warrants, each whole warrant exercisable for one share of Common Stock at an exercise price of $11.50",stocks,us,XNYS,WARRANT,usd
5849,JOE,St. Joe Company,stocks,us,XNYS,CS,usd
5850,JOET,Virtus Terranova U.S. Quality Momentum ETF,stocks,us,ARCX,ETF,usd
5851,JOF,JAPAN SMALLER CAPITALIZATION FUND,stocks,us,XNYS,FUND,usd
5852,JOJO,ATAC Credit Rotation ETF,stocks,us,ARCX,ETF,usd
5853,JOUT,Johnson Outdoors Inc,stocks,us,XNAS,CS,usd
5854,JOYT,JPMorgan Equity and Options Total Return ETF,stocks,us,BATS,ETF,usd
5855,JOYY,JOYY Inc. American Depositary Shares,stocks,us,XNAS,ADRC,usd
5856,JPAN,Matthews Japan Active ETF,stocks,us,ARCX,ETF,usd
5857,JPC,Nuveen Preferred & Income Opportunities Fund,stocks,us,XNYS,FUND,usd
5858,JPEF,JPMorgan Equity Focus ETF,stocks,us,XNAS,ETF,usd
5859,JPEM,JPMorgan Diversified Return Emerging Markets Equity ETF,stocks,us,ARCX,ETF,usd
5860,JPHY,JPMorgan Active High Yield ETF,stocks,us,BATS,ETF,usd
5861,JPIB,JPMorgan International Bond Opportunities ETF,stocks,us,BATS,ETF,usd
5862,JPIE,JPMorgan Income ETF,stocks,us,ARCX,ETF,usd
5863,JPIN,JPMorgan Diversified Return International Equity ETF,stocks,us,ARCX,ETF,usd
5864,JPLD,JPMorgan Limited Duration Bond ETF,stocks,us,BATS,ETF,usd
5865,JPM,JPMorgan Chase & Co.,stocks,us,XNYS,CS,usd
5866,JPMB,JPMorgan USD Emerging Markets Sovereign Bond ETF,stocks,us,ARCX,ETF,usd
5867,JPME,JPMorgan Diversified Return US Mid Cap Equity ETF,stocks,us,ARCX,ETF,usd
5868,JPMO,YieldMax JPM Option Income Strategy ETF,stocks,us,ARCX,ETS,usd
5869,JPMpC,"JPMorgan Chase & Co. Depositary Shares, each representing a 1/400th interest in a share of 6.00% Non-Cumulative Preferred Stock, Series EE",stocks,us,XNYS,PFD,usd
5870,JPMpD,"JPMorgan Chase & Co. Depositary Shares, each representing a 1/400th  interest in a share of 5.75% Non-Cumulative  Preferred Stock, Series DD",stocks,us,XNYS,PFD,usd
5871,JPMpJ,"JPMorgan Chase & Co. Depositary Shares, each representing a 1/400th interest in a share of JPMorgan Chase & Co. 4.75% Non-Cumulative Preferred Stock, Series GG",stocks,us,XNYS,PFD,usd
5872,JPMpK,"JPMorgan Chase & Co. Depositary Shares, each representing a 1/400th interest in a share of 4.55% Non-Cumulative Preferred Stock, Series JJ",stocks,us,XNYS,PFD,usd
5873,JPMpL,"JPMorgan Chase & Co. Depositary Shares, each representing a 1/400th interest in a share of 4.625% Non-Cumulative Preferred Stock, Series LL",stocks,us,XNYS,PFD,usd
5874,JPMpM,"JPMorgan Chase & Co. Depositary Shares, each representing a 1/400th interest in a share of 4.20% Non-Cumulative Preferred Stock, Series MM",stocks,us,XNYS,PFD,usd
5875,JPRE,JPMorgan Realty Income ETF,stocks,us,ARCX,ETF,usd
5876,JPSE,JPMorgan Diversified Return US Small Cap Equity ETF,stocks,us,ARCX,ETF,usd
5877,JPST,JPMorgan Ultra-Short Income ETF,stocks,us,ARCX,ETF,usd
5878,JPSV,JPMorgan Active Small Cap Value ETF,stocks,us,ARCX,ETF,usd
5879,JPUS,JPMorgan Diversified Return US Equity ETF,stocks,us,ARCX,ETF,usd
5880,JPX,Defiance Daily Target 2X Long JPM ETF,stocks,us,XNAS,ETF,usd
5881,JPXN,iShares JPX-Nikkei 400 ETF,stocks,us,ARCX,ETF,usd
5882,JPY,Lazard Japanese Equity ETF,stocks,us,XNAS,ETF,usd
5883,JQC,Nuveen Credit Strategies Income Fund,stocks,us,XNYS,FUND,usd
5884,JQUA,JPMorgan U.S. Quality Factor ETF,stocks,us,ARCX,ETF,usd
5885,JRE,Janus Henderson U.S. Real Estate ETF,stocks,us,ARCX,ETF,usd
5886,JRI,NUVEEN REAL ASSET INCOME AND GROWTH FUND,stocks,us,XNYS,FUND,usd
5887,JRS,Nuveen Real Estate Income Fund,stocks,us,XNYS,FUND,usd
5888,JRSH,"Jerash Holdings (US), Inc. Common Stock",stocks,us,XNAS,CS,usd
5889,JRVR,"James River Group Holdings, Ltd",stocks,us,XNAS,CS,usd
5890,JSCP,JPMorgan Short Duration Core Plus ETF,stocks,us,ARCX,ETF,usd
5891,JSI,Janus Henderson Securitized Income ETF,stocks,us,ARCX,ETF,usd
5892,JSM,"Navient Corporation 6% Senior Notes due December 15, 2043",stocks,us,XNAS,CS,usd
5893,JSMD,Janus Detroit Street Trust Janus Henderson Small/Mid Cap Growth Alpha ETF,stocks,us,XNAS,ETF,usd
5894,JSML,Janus Detroit Street Trust Janus Henderson Small Cap Growth Alpha ETF,stocks,us,XNAS,ETF,usd
5895,JSPR,"Jasper Therapeutics, Inc. Common Stock",stocks,us,XNAS,CS,usd
5896,JSPRW,"Japer Therapeutics, Inc. Warrants",stocks,us,XNAS,WARRANT,usd
5897,JSTC,Adasina Social Justice All Cap Global ETF,stocks,us,ARCX,ETF,usd
5898,JTAI,Jet.AI Inc. Common Stock,stocks,us,XNAS,CS,usd
5899,JTEK,JPMorgan U.S. Tech Leaders ETF,stocks,us,XNAS,ETF,usd
5900,JUCY,Aptus Enhanced Yield ETF,stocks,us,BATS,ETF,usd
5901,JULB,Aptus July Buffer ETF,stocks,us,BATS,ETF,usd
5902,JULH,Innovator Premium Income 20 Barrier ETF - July,stocks,us,BATS,ETF,usd
5903,JULJ,Innovator Premium Income 30 Barrier ETF - July,stocks,us,BATS,ETF,usd
5904,JULM,FT Vest U.S. Equity Max Buffer ETF - July,stocks,us,BATS,ETF,usd
5905,JULP,PGIM S&P 500 Buffer 12 ETF - July,stocks,us,BATS,ETF,usd
5906,JULT,AllianzIM U.S. Large Cap Buffer10 Jul ETF,stocks,us,ARCX,ETS,usd
5907,JULU,AllianzIM U.S. Equity Buffer15 Uncapped Jul ETF,stocks,us,BATS,ETF,usd
5908,JULW,AllianzIM U.S. Large Cap Buffer20 Jul ETF,stocks,us,ARCX,ETS,usd
5909,JULZ,TrueShares Structured Outcome (July) ETF,stocks,us,BATS,ETF,usd
5910,JUNM,FT Vest U.S. Equity Max Buffer ETF - June,stocks,us,BATS,ETF,usd
5911,JUNP,PGIM S&P 500 Buffer 12 ETF - June,stocks,us,BATS,ETF,usd
5912,JUNS,"Jupiter Neurosciences, Inc. Common Stock",stocks,us,XNAS,CS,usd
5913,JUNT,AllianzIM U.S. Large Cap Buffer10 Jun ETF,stocks,us,ARCX,ETS,usd
5914,JUNW,AllianzIM U.S. Large Cap Buffer20 Jun ETF,stocks,us,ARCX,ETS,usd
5915,JUNZ,TrueShares Structured Outcome (June) ETF,stocks,us,BATS,ETF,usd
5916,JUSA,JPMorgan U.S. Research Enhanced Large Cap ETF,stocks,us,ARCX,ETF,usd
5917,JUST,Goldman Sachs JUST U.S. Large Cap Equity ETF,stocks,us,ARCX,ETF,usd
5918,JVA,"Coffee Holding Co., Inc.",stocks,us,XNAS,CS,usd
5919,JVAL,JPMorgan U.S. Value Factor ETF,stocks,us,ARCX,ETF,usd
5920,JWEL,Jowell Global Ltd. Ordinary Shares,stocks,us,XNAS,CS,usd
5921,JXG,JX Luxventure Limited Common Stock,stocks,us,XNAS,CS,usd
5922,JXI,iShares Global Utilities ETF,stocks,us,ARCX,ETF,usd
5923,JXN,Jackson Financial Inc.,stocks,us,XNYS,CS,usd
5924,JXNpA,"Jackson Financial Inc. Depositary Shares, each representing a 1/1,000th interest in a share of Fixed-Rate Reset Noncumulative Perpetual Preferred Stock, Series A",stocks,us,XNYS,PFD,usd
5925,JXX,Janus Henderson Transformational Growth ETF,stocks,us,BATS,ETF,usd
5926,JYD,Jayud Global Logistics Limited Class A Ordinary Shares,stocks,us,XNAS,CS,usd
5927,JYNT,The Joint Corp.,stocks,us,XNAS,CS,usd
5928,JZ,Jianzhi Education Technology Group Company Limited American Depositary Shares,stocks,us,XNAS,ADRC,usd
5929,JZXN,"Jiuzi Holdings, Inc. Ordinary Shares",stocks,us,XNAS,CS,usd
5930,K,Kellanova,stocks,us,XNYS,CS,usd
5931,KAI,Kadant Inc.,stocks,us,XNYS,CS,usd
5932,KALA,"KALA BIO, Inc. Common Stock",stocks,us,XNAS,CS,usd
5933,KALU,Kaiser Aluminum Corporation,stocks,us,XNAS,CS,usd
5934,KALV,"KalVista Pharmaceuticals, Inc. Common Stock",stocks,us,XNAS,CS,usd
5935,KAPA,"Kairos Pharma, Ltd.",stocks,us,XASE,CS,usd
5936,KAPR,Innovator U.S. Small Cap Power Buffer ETF - April,stocks,us,BATS,ETF,usd
5937,KAR,"OPENLANE, Inc",stocks,us,XNYS,CS,usd
5938,KARO,Karooooo Ltd. Ordinary Shares,stocks,us,XNAS,CS,usd
5939,KARS,KraneShares Electric Vehicles and Future Mobility Index ETF,stocks,us,ARCX,ETF,usd
5940,KAT,Scharf ETF,stocks,us,XNAS,ETF,usd
5941,KAUG,Innovator US Small Cap Power Buffer ETF - August,stocks,us,BATS,ETF,usd
5942,KAVL,"Kaival Brands Innovations Group, Inc",stocks,us,XNAS,CS,usd
5943,KB,KB Financial Group Inc,stocks,us,XNYS,ADRC,usd
5944,KBA,KraneShares Bosera MSCI China A 50 Connect Index ETF,stocks,us,ARCX,ETF,usd
5945,KBAB,KraneShares 2x Long BABA Daily ETF,stocks,us,XNAS,ETF,usd
5946,KBDC,"Kayne Anderson BDC, Inc.",stocks,us,XNYS,CS,usd
5947,KBE,SPDR S&P Bank ETF,stocks,us,ARCX,ETF,usd
5948,KBH,KB Home,stocks,us,XNYS,CS,usd
5949,KBR,"KBR, Inc.",stocks,us,XNYS,CS,usd
5950,KBSX,FST Corp. Ordinary Shares,stocks,us,XNAS,CS,usd
5951,KBUF,KraneShares 90% KWEB Defined Outcome January 2027 ETF,stocks,us,ARCX,ETF,usd
5952,KBWB,Invesco KBW Bank ETF,stocks,us,XNAS,ETF,usd
5953,KBWD,Invesco KBW High Dividend Yield Financial ETF,stocks,us,XNAS,ETF,usd
5954,KBWP,Invesco KBW Property & Casualty Insurance ETF,stocks,us,XNAS,ETF,usd
5955,KBWR,Invesco KBW Regional Banking ETF,stocks,us,XNAS,ETF,usd
5956,KBWY,Invesco KBW Premium Yield Equity REIT ETF,stocks,us,XNAS,ETF,usd
5957,KC,Kingsoft Cloud Holdings Limited American Depositary Shares,stocks,us,XNAS,ADRC,usd
5958,KCAI,KraneShares China Alpha Index ETF,stocks,us,ARCX,ETF,usd
5959,KCCA,KraneShares California Carbon Allowance Strategy ETF,stocks,us,ARCX,ETF,usd
5960,KCE,SPDR S&P Capital Markets ETF,stocks,us,ARCX,ETF,usd
5961,KCHV,Kochav Defense Acquisition Corp. Class A Ordinary Shares,stocks,us,XNAS,CS,usd
5962,KCHVR,Kochav Defense Acquisition Corp. Right,stocks,us,XNAS,RIGHT,usd
5963,KCHVU,Kochav Defense Acquisition Corp. Units,stocks,us,XNAS,UNIT,usd
5964,KCSH,KraneShares Sustainable Ultra Short Duration Index ETF,stocks,us,ARCX,ETF,usd
5965,KD,"Kyndryl Holdings, Inc.",stocks,us,XNYS,CS,usd
5966,KDEC,Innovator U.S. Small Cap Power Buffer ETF - December,stocks,us,BATS,ETF,usd
5967,KDEF,PLUS Korea Defense Industry Index ETF,stocks,us,ARCX,ETF,usd
5968,KDK,"Kodiak AI, Inc. Common Stock",stocks,us,XNAS,CS,usd
5969,KDKRW,"Kodiak AI, Inc. Warrants",stocks,us,XNAS,WARRANT,usd
5970,KDP,Keurig Dr Pepper Inc.,stocks,us,XNAS,CS,usd
5971,KDRN,Kingsbarn Tactical Bond ETF,stocks,us,ARCX,ETF,usd
5972,KE,"Kimball Electronics, Inc.",stocks,us,XNAS,CS,usd
5973,KEAT,Keating Active ETF,stocks,us,XNAS,ETF,usd
5974,KELYA,Kelly Services Inc,stocks,us,XNAS,CS,usd
5975,KELYB,Kelly Services Inc,stocks,us,XNAS,CS,usd
5976,KEMQ,KraneShares Emerging Markets Consumer Technology Index ETF,stocks,us,ARCX,ETF,usd
5977,KEMX,KraneShares MSCI Emerging Markets Ex China Index ETF,stocks,us,ARCX,ETF,usd
5978,KEN,KENON HOLDINGS LTD.,stocks,us,XNYS,CS,usd
5979,KEP,Korea Electric Power Corp,stocks,us,XNYS,ADRC,usd
5980,KEQU,Kewaunee Scientific Corp,stocks,us,XNAS,CS,usd
5981,KEUA,KraneShares European Carbon Allowance Strategy ETF,stocks,us,ARCX,ETF,usd
5982,KEX,Kirby Corporation,stocks,us,XNYS,CS,usd
5983,KEY,KeyCorp,stocks,us,XNYS,CS,usd
5984,KEYS,"Keysight Technologies, Inc.",stocks,us,XNYS,CS,usd
5985,KEYpI,"KeyCorp Depositary Shares each representing a 1/40th ownership interest in a share of Fixed-to-Floating Rate Perpetual Non-Cumulative Preferred Stock, Series E",stocks,us,XNYS,PFD,usd
5986,KEYpJ,"KeyCorp Depositary Shares each representing a 1/40th ownership interest in a share of Fixed Rate Perpetual Non-Cumulative Preferred Stock, Series F",stocks,us,XNYS,PFD,usd
5987,KEYpK,"KeyCorp Depositary Shares, each representing a 1/40th ownership interest in a share of Fixed Rate Perpetual Non-Cumulative Preferred Stock, Series G",stocks,us,XNYS,PFD,usd
5988,KEYpL,"KeyCorp Depositary Shares each representing a 1/40th ownership interest in a share of Fixed Rate Perpetual Non-Cumulative Preferred Stock, Series H",stocks,us,XNYS,PFD,usd
5989,KF,"KOREA FUND, INC",stocks,us,XNYS,FUND,usd
5990,KFEB,Innovator U.S. Small Cap Power Buffer ETF - February,stocks,us,BATS,ETF,usd
5991,KFFB,Kentucky First Federal Bancorp,stocks,us,XNAS,CS,usd
5992,KFII,K&F Growth Acquisition Corp. II Class A Ordinary shares,stocks,us,XNAS,CS,usd
5993,KFIIR,K&F Growth Acquisition Corp. II Rights,stocks,us,XNAS,RIGHT,usd
5994,KFIIU,K&F Growth Acquisition Corp. II Unit,stocks,us,XNAS,UNIT,usd
5995,KFRC,Kforce Inc.,stocks,us,XNYS,CS,usd
5996,KFS,"Kingsway Financial Services, Inc.",stocks,us,XNYS,CS,usd
5997,KFY,Korn Ferry,stocks,us,XNYS,CS,usd
5998,KG,"Kestrel Group, Ltd.",stocks,us,XNAS,CS,usd
5999,KGC,Kinross Gold Corporation,stocks,us,XNYS,CS,usd
6000,KGEI,Kolibri Global Energy Inc. Common Stock,stocks,us,XNAS,CS,usd
6001,KGLD,Kurv Gold Enhanced Income ETF,stocks,us,BATS,ETF,usd
6002,KGRN,KraneShares MSCI China Clean Technology Index ETF,stocks,us,ARCX,ETF,usd
6003,KGS,"Kodiak Gas Services, Inc.",stocks,us,XNYS,CS,usd
6004,KHC,The Kraft Heinz Company Common Stock,stocks,us,XNAS,CS,usd
6005,KHPI,Kensington Hedged Premium Income ETF,stocks,us,BATS,ETF,usd
6006,KHYB,KraneShares Asia Pacific High Income USD Bond ETF,stocks,us,ARCX,ETF,usd
6007,KIDS,OrthoPediatrics Corp. Common Stock,stocks,us,XNAS,CS,usd
6008,KIDZ,"Classover Holdings, Inc. Class B Common Stock",stocks,us,XNAS,CS,usd
6009,KIDZW,"Classover Holdings, Inc. Warrants",stocks,us,XNAS,WARRANT,usd
6010,KIE,SPDR S&P Insurance ETF,stocks,us,ARCX,ETF,usd
6011,KIM,Kimco Realty Corp.,stocks,us,XNYS,CS,usd
6012,KIMpL,"Kimco Realty Corporation Class L Depositary Shares, each of which represents a one-one thousandth fractional interest in a share of 5.125% Class L Cumulative Redeemable Preferred Stock, liquidation preference $25,000.00 per share",stocks,us,XNYS,PFD,usd
6013,KIMpM,"Kimco Realty Corporation Class M Depositary Shares, each of which represents a one-one thousandth fractional interest in a share of 5.25% Class M Cumulative Redeemable Preferred Stock",stocks,us,XNYS,PFD,usd
6014,KIMpN,"Kimco Realty Corporation Depositary Shares, each representing 1/1,000th interest in a share of 7.25% Class N Cumulative Convertible Perpetual Preferred Stock",stocks,us,XNYS,PFD,usd
6015,KINS,"Kingstone Companies, Inc.",stocks,us,XNAS,CS,usd
6016,KIO,KKR INCOME OPPORTUNITIES FUND,stocks,us,XNYS,FUND,usd
6017,KITT,"Nauticus Robotics, Inc. Common stock",stocks,us,XNAS,CS,usd
6018,KITTW,"Nauticus Robotics, Inc Warrant",stocks,us,XNAS,WARRANT,usd
6019,KJAN,Innovator U.S. Small Cap Power Buffer ETF - January,stocks,us,BATS,ETF,usd
6020,KJD,KraneShares 2x Long JD Daily ETF,stocks,us,XNAS,ETF,usd
6021,KJUL,Innovator U.S. Small Cap Power Buffer ETF - July,stocks,us,BATS,ETF,usd
6022,KJUN,Innovator U.S. Small Cap Power Buffer ETF - June,stocks,us,BATS,ETF,usd
6023,KKR,KKR & Co. Inc.,stocks,us,XNYS,CS,usd
6024,KKRS,KKR Group Finance Co. IX LLC 4.625% Subordinated Notes due 2061,stocks,us,XNYS,SP,usd
6025,KKRT,KKR & Co. Inc. 6.875% Subordinated Notes due 2065,stocks,us,XNYS,SP,usd
6026,KKRpD,KKR & Co. Inc. 6.25% Series D Mandatory Convertible Preferred Stock,stocks,us,XNYS,SP,usd
6027,KLAC,KLA Corporation Common Stock,stocks,us,XNAS,CS,usd
6028,KLAR,Klarna Group plc,stocks,us,XNYS,CS,usd
6029,KLC,"KinderCare Learning Companies, Inc.",stocks,us,XNYS,CS,usd
6030,KLIC,Kulicke & Soffa Industries Inc,stocks,us,XNAS,CS,usd
6031,KLIP,KraneShares KWEB Covered Call Strategy ETF,stocks,us,ARCX,ETF,usd
6032,KLMN,Invesco MSCI North America Climate ETF,stocks,us,ARCX,ETF,usd
6033,KLMT,Invesco MSCI Global Climate 500 ETF,stocks,us,ARCX,ETF,usd
6034,KLRS,"Kalaris Therapeutics, Inc. Common Stock",stocks,us,XNAS,CS,usd
6035,KLTO,"Klotho Neurosciences, Inc. Common Stock",stocks,us,XNAS,CS,usd
6036,KLTOW,"Klotho Neurosciences, Inc. Warrant",stocks,us,XNAS,WARRANT,usd
6037,KLTR,"Kaltura, Inc. Common Stock",stocks,us,XNAS,CS,usd
6038,KLXE,"KLX Energy Services Holdings, Inc. Common Stock",stocks,us,XNAS,CS,usd
6039,KLXY,KraneShares Global Luxury Index ETF,stocks,us,ARCX,ETF,usd
6040,KMAR,Innovator U.S. Small Cap Power Buffer ETF - March,stocks,us,BATS,ETF,usd
6041,KMAY,Innovator U.S. Small Cap Power Buffer ETF - May,stocks,us,BATS,ETF,usd
6042,KMB,Kimberly-Clark Corp.,stocks,us,XNAS,CS,usd
6043,KMDA,Kamada Ltd,stocks,us,XNAS,CS,usd
6044,KMI,"Kinder Morgan, Inc.",stocks,us,XNYS,CS,usd
6045,KMID,Virtus KAR Mid-Cap ETF,stocks,us,ARCX,ETF,usd
6046,KMLI,KraneShares 2x Long MELI Daily ETF,stocks,us,XNAS,ETF,usd
6047,KMLM,KraneShares Mount Lucas Managed Futures Index Strategy ETF,stocks,us,ARCX,ETF,usd
6048,KMPB,Kemper Corporation 5.875% Fixed-Rate Reset Junior Subordinated Debentures due 2062,stocks,us,XNYS,SP,usd
6049,KMPR,Kemper Corporation,stocks,us,XNYS,CS,usd
6050,KMRK,K-Tech Solutions Company Limited Class A Ordinary Shares,stocks,us,XNAS,CS,usd
6051,KMT,Kennametal Inc.,stocks,us,XNYS,CS,usd
6052,KMTS,"Kestra Medical Technologies, Ltd. Common Stock",stocks,us,XNAS,CS,usd
6053,KMX,CarMax Inc.,stocks,us,XNYS,CS,usd
6054,KN,KNOWLES CORPORATION,stocks,us,XNYS,CS,usd
6055,KNCT,Invesco Next Gen Connectivity ETF,stocks,us,ARCX,ETF,usd
6056,KNDI,"Kandi Technologies Group, Inc. Ordinary Shares",stocks,us,XNAS,CS,usd
