1,A,Agilent Technologies Inc.,stocks,us,XNYS,CS,usd
8927,RFM,"RiverNorth Flexible Municipal Income Fund, Inc.",stocks,us,XNYS,FUND,usd
8928,RFMZ,"RiverNorth Flexible Municipal Income Fund II, Inc.",stocks,us,XNYS,FUND,usd
8929,RFV,Invesco S&P MidCap 400 Pure Value ETF,stocks,us,ARCX,ETF,usd
8930,RFpC,"Regions Financial Corporation Depositary Shares, each Representing a 1/40th Interest in a Share of 5.700% Fixed-to-Floating Rate Non-Cumulative Perpetual Preferred Stock, Series C",stocks,us,XNYS,PFD,usd
8931,RFpE,"Regions Financial Corporation Depositary Shares, Each Representing a 1/40th Interest in a Share of 4.45% Non-Cumulative Perpetual Preferred Stock, Series E",stocks,us,XNYS,PFD,usd
8932,RFpF,"Regions Financial Corporation Depositary Shares Each Representing a 1/40th Interest in a Share of Non-Cumulative Perpetual Preferred Stock, Series F",stocks,us,XNYS,PFD,usd
8933,RGA,"Reinsurance Group of America, Incorporated",stocks,us,XNYS,CS,usd
8934,RGC,Regencell Bioscience Holdings Limited Ordinary Shares,stocks,us,XNAS,CS,usd
8935,RGCO,RGC Resources Inc,stocks,us,XNAS,CS,usd
8936,RGEF,Rockefeller Global Equity ETF,stocks,us,ARCX,ETF,usd
8937,RGEN,Repligen Corp,stocks,us,XNAS,CS,usd
8938,RGLD,Royal Gold Inc,stocks,us,XNAS,CS,usd
8939,RGLO,Russell Investments Exchange Traded Funds Russell Investments Global Equity ETF,stocks,us,XNAS,ETF,usd
8940,RGNX,REGENXBIO Inc.,stocks,us,XNAS,CS,usd
8941,RGP,Resources Connection,stocks,us,XNAS,CS,usd
8942,RGR,"Sturm, Ruger & Company, Inc.",stocks,us,XNYS,CS,usd
8943,RGS,Regis Corporation,stocks,us,XNAS,CS,usd
8944,RGT,"Royce Global Trust, Inc.",stocks,us,XNYS,FUND,usd
8945,RGTI,"Rigetti Computing, Inc. Common Stock",stocks,us,XNAS,CS,usd
8946,RGTIW,"Rigetti Computing, Inc. Warrants",stocks,us,XNAS,WARRANT,usd
8947,RGTU,Tradr 2X Long RGTI Daily ETF,stocks,us,BATS,ETF,usd
8948,RGTX,Defiance Daily Target 2X Long RGTI ETF,stocks,us,XNAS,ETF,usd
8949,RGTZ,Defiance Daily Target 2x Short RGTI ETF,stocks,us,XNAS,ETF,usd
8950,RH,RH,stocks,us,XNYS,CS,usd
8951,RHI,Robert Half Inc.,stocks,us,XNYS,CS,usd
8952,RHLD,"Resolute Holdings Management, Inc.",stocks,us,XNYS,CS,usd
8953,RHP,"Ryman Hospitality Properties, Inc",stocks,us,XNYS,CS,usd
8954,RHRX,RH Tactical Rotation ETF,stocks,us,ARCX,ETF,usd
8955,RHTX,RH Tactical Outlook ETF,stocks,us,ARCX,ETF,usd
8956,RIBB,Ribbon Acquisition Corp Class A Ordinary Shares,stocks,us,XNAS,CS,usd
8957,RIBBR,Ribbon Acquisition Corp Rights,stocks,us,XNAS,RIGHT,usd
8958,RIBBU,Ribbon Acquisition Corp Unit,stocks,us,XNAS,UNIT,usd
8959,RICK,"RCI Hospitality Holdings, Inc.",stocks,us,XNAS,CS,usd
8960,RIET,Hoya Capital High Dividend Yield ETF,stocks,us,ARCX,ETF,usd
8961,RIFR,Russell Investments Exchange Traded Funds Russell Investments Global Infrastructure ETF,stocks,us,XNAS,ETF,usd
8962,RIG,Transocean LTD.,stocks,us,XNYS,CS,usd
8963,RIGL,Rigel Pharmaceuticals Inc. (New),stocks,us,XNAS,CS,usd
8964,RIGS,RiverFront Strategic Income Fund,stocks,us,ARCX,ETF,usd
8965,RILA,Indexperts Gorilla Aggressive Growth ETF,stocks,us,ARCX,ETF,usd
8966,RILY,"B. RILEY FINANCIAL, INC.",stocks,us,XNAS,CS,usd
8967,RILYG,"B. Riley Financial, Inc. 5.00% Senior Notes due 2026",stocks,us,XNAS,CS,usd
8968,RILYK,"B. Riley Financial, Inc. 5.50% Senior Notes Due 2026",stocks,us,XNAS,CS,usd
8969,RILYL,"B. Riley Financial, Inc. Depositary Shares each representing 1/1000th in a share of 7.375% Series B Cumulative Perpetual Preferred Stock, par value $0.0001",stocks,us,XNAS,CS,usd
8970,RILYN,"B. Riley Financial, Inc. 6.50% Senior Notes Due 2026",stocks,us,XNAS,CS,usd
8971,RILYP,"B. Riley Financial, Inc. Depositary Shares, each representing a 1/1000th fractional interest in a share of Series A Cumulative Perpetual Preferred Stock",stocks,us,XNAS,PFD,usd
8972,RILYT,"B. Riley Financial, Inc. 6.00% Senior Notes Due 2028",stocks,us,XNAS,CS,usd
8973,RILYZ,"B. Riley Financial, Inc. 5.25% Senior Notes due 2028",stocks,us,XNAS,CS,usd
8974,RIME,"Algorhythm Holdings, Inc. Common Stock",stocks,us,XNAS,CS,usd
8975,RINF,ProShares Inflation Expectations ETF,stocks,us,ARCX,ETF,usd
8976,RING,iShares MSCI Global Gold Miners ETF,stocks,us,XNAS,ETF,usd
8977,RINT,Russell Investments Exchange Traded Funds Russell Investments International Developed Equity ETF,stocks,us,XNAS,ETF,usd
8978,RIO,Rio Tinto plc,stocks,us,XNYS,ADRC,usd
8979,RIOT,"Riot Platforms, Inc. Common Stock",stocks,us,XNAS,CS,usd
8980,RIOX,Defiance Daily Target 2X Long RIOT ETF,stocks,us,ARCX,ETS,usd
8981,RISN,Inspire Tactical Balanced ETF,stocks,us,ARCX,ETF,usd
8982,RISR,FolioBeyond Alternative Income and Interest Rate Hedge ETF,stocks,us,ARCX,ETF,usd
8983,RITA,ETFB Green SRI REITs ETF,stocks,us,ARCX,ETF,usd
8984,RITM,Rithm Capital Corp.,stocks,us,XNYS,CS,usd
8985,RITMpA,Rithm Capital Corp.7.50% Series A Fixed-to-Floating Rate Cumulative Redeemable Preferred Stock,stocks,us,XNYS,PFD,usd
8986,RITMpB,Rithm Capital Corp. 7.125% Series B Fixed-to-Floating Rate Cumulative Redeemable Preferred Stock,stocks,us,XNYS,PFD,usd
8987,RITMpC,Rithm Capital Corp. 6.375% Series C Fixed-to-Floating Rate Cumulative Redeemable Preferred Stock,stocks,us,XNYS,PFD,usd
8988,RITMpD,Rithm Capital Corp. 7.00% Fixed-Rate Reset Series D Cumulative Redeemable Preferred Stock,stocks,us,XNYS,PFD,usd
8989,RITMpE,Rithm Capital Corp. 8.75% Series E Fixed-Rate Cumulative Redeemable Preferred Stock,stocks,us,XNYS,PFD,usd
8990,RITR,Reitar Logtech Holdings Limited Ordinary shares,stocks,us,XNAS,CS,usd
8991,RIV,"RiverNorth Opportunities Fund, Inc. Common Stock",stocks,us,XNYS,FUND,usd
8992,RIVN,"Rivian Automotive, Inc. Class A Common Stock",stocks,us,XNAS,CS,usd
8993,RIVpA,"RiverNorth Opportunities Fund, Inc. 6.00% Series A Perpetual Preferred Stock",stocks,us,XNYS,PFD,usd
8994,RJDI,RJ Eagle GCM Dividend Select Income ETF,stocks,us,ARCX,ETF,usd
8995,RJF,"Raymond James Financial, Inc.",stocks,us,XNYS,CS,usd
8996,RJFpB,"Raymond James Financial, Inc. Depositary Shares, each representing a 1/40th interest in a share of 6.375% Fixed-to-Floating Rate Series B Non-Cumulative Perpetual Preferred Stock",stocks,us,XNYS,PFD,usd
8997,RJMG,FT Raymond James Multicap Growth Equity ETF,stocks,us,ARCX,ETF,usd
8998,RJMI,RJ Eagle Municipal Income ETF,stocks,us,ARCX,ETF,usd
8999,RJVI,RJ Eagle Vertical Income ETF,stocks,us,ARCX,ETF,usd
9000,RKDA,"Arcadia Biosciences, Inc.",stocks,us,XNAS,CS,usd
9001,RKLB,Rocket Lab Corporation Common Stock,stocks,us,XNAS,CS,usd
9002,RKLX,Defiance Daily Target 2X Long RKLB ETF,stocks,us,XNAS,ETF,usd
9003,RKT,"Rocket Companies, Inc.",stocks,us,XNYS,CS,usd
9004,RL,Ralph Lauren Corporation,stocks,us,XNYS,CS,usd
9005,RLAY,"Relay Therapeutics, Inc. Common Stock",stocks,us,XNAS,CS,usd
9006,RLGT,"Radiant Logistics, Inc.",stocks,us,XASE,CS,usd
9007,RLI,RLI Corp.,stocks,us,XNYS,CS,usd
9008,RLJ,RLJ Lodging Trust,stocks,us,XNYS,CS,usd
9009,RLJpA,RLJ Lodging Trust $1.95 Series A Cumulative Convertible Preferred Shares,stocks,us,XNYS,PFD,usd
9010,RLMD,"Relmada Therapeutics, Inc. Common Stock",stocks,us,XNAS,CS,usd
9011,RLTY,Cohen & Steers Real Estate Opportunities and Income Fund,stocks,us,XNYS,FUND,usd
9012,RLX,"RLX Technology Inc. American Depositary Shares, each representing the right to receive one (1) Class A ordinary share",stocks,us,XNYS,ADRC,usd
9013,RLY,SPDR SSgA Multi-Asset Real Return ETF of SSgA Active Trust,stocks,us,ARCX,ETF,usd
9014,RLYB,Rallybio Corporation Common Stock,stocks,us,XNAS,CS,usd
9015,RM,REGIONAL MANAGEMENT CORP,stocks,us,XNYS,CS,usd
9016,RMAX,"RE/MAX HOLDINGS, INC.",stocks,us,XNYS,CS,usd
9017,RMBI,"Richmond Mutual Bancorporation, Inc. Common Stock",stocks,us,XNAS,CS,usd
9018,RMBS,Rambus Inc,stocks,us,XNAS,CS,usd
9019,RMCA,Rockefeller California Municipal Bond ETF,stocks,us,ARCX,ETF,usd
9020,RMCF,"Rocky Mountain Chocolate Factory, Inc. Common Stock",stocks,us,XNAS,CS,usd
9021,RMCO,Royalty Management Holding Corporation Class A Common Stock,stocks,us,XNAS,CS,usd
9022,RMCOW,Royalty Management Holding Corporation Warrant,stocks,us,XNAS,WARRANT,usd
9023,RMD,ResMed Inc.,stocks,us,XNYS,CS,usd
9024,RMI,"RiverNorth Opportunistic Municipal Income Fund, Inc. Common Stock",stocks,us,XNYS,FUND,usd
9025,RMIF,LHA Risk-Managed Income ETF,stocks,us,BATS,ETF,usd
9026,RMM,"RiverNorth Managed Duration Municipal Income Fund, Inc.",stocks,us,XNYS,FUND,usd
9027,RMMZ,"RiverNorth Managed Duration Municipal Income Fund II, Inc.",stocks,us,XNYS,FUND,usd
9028,RMNI,"Rimini Street, Inc. (DE) Common Stock",stocks,us,XNAS,CS,usd
9029,RMNY,Rockefeller New York Municipal Bond ETF,stocks,us,ARCX,ETF,usd
9030,RMOP,Rockefeller Opportunistic Municipal Bond ETF,stocks,us,ARCX,ETF,usd
9031,RMR,The RMR Group Inc. Class A Common Stock,stocks,us,XNAS,CS,usd
9032,RMSG,Real Messenger Corporation Ordinary Shares,stocks,us,XNAS,CS,usd
9033,RMSGW,Real Messenger Corporation Warrants,stocks,us,XNAS,WARRANT,usd
9034,RMT,Royce Micro-Cap Trust Inc,stocks,us,XNYS,FUND,usd
9035,RMTI,"Rockwell Medical, Inc. (DE) Common Stock",stocks,us,XNAS,CS,usd
9036,RNA,"Avidity Biosciences, Inc. Common Stock",stocks,us,XNAS,CS,usd
9037,RNAC,"Cartesian Therapeutics, Inc. Common Stock",stocks,us,XNAS,CS,usd
9038,RNAZ,"TransCode Therapeutics, Inc. Common Stock",stocks,us,XNAS,CS,usd
9039,RND,First Trust Bloomberg R&D Leaders ETF,stocks,us,ARCX,ETF,usd
9040,RNEM,First Trust Emerging Markets Equity Select ETF,stocks,us,XNAS,ETF,usd
9041,RNG,"RINGCENTRAL, INC.",stocks,us,XNYS,CS,usd
9042,RNGR,"Ranger Energy Services, Inc.",stocks,us,XNYS,CS,usd
9043,RNGTU,Range Capital Acquisition Corp II Units,stocks,us,XNAS,UNIT,usd
9044,RNIN,Bushido Capital US SMID Cap Equity ETF,stocks,us,XNAS,ETF,usd
9045,RNP,"Cohen & Steers REIT and Preferred and Income Fund, Inc.",stocks,us,XNYS,FUND,usd
9046,RNR,RenaissanceRe Holdings Ltd.,stocks,us,XNYS,CS,usd
9047,RNRG,Global X Funds Global X Renewable Energy Producers ETF,stocks,us,XNAS,ETF,usd
9048,RNRpF,"RenaissanceRe Holdings Ltd. Depositary Shares, each Representing a 1/1,000th Interest in a 5.750% Series F Preference Share",stocks,us,XNYS,PFD,usd
9049,RNRpG,"RenaissanceRe Holdings Ltd. Depositary Shares, each representing a 1/1, 000th interest in a share of 4.20% Series G Preference Shares",stocks,us,XNYS,PFD,usd
9050,RNST,Renasant Corporation,stocks,us,XNYS,CS,usd
9051,RNTX,"Rein Therapeutics, Inc. Common Stock",stocks,us,XNAS,CS,usd
9052,RNTY,YieldMax Target 12 Real Estate Option Income ETF,stocks,us,ARCX,ETF,usd
9053,RNW,ReNew Energy Global plc Class A Ordinary Shares,stocks,us,XNAS,CS,usd
9054,RNWWW,ReNew Energy Global plc Warrant,stocks,us,XNAS,WARRANT,usd
9055,RNWZ,TrueShares Eagle Global Renewable Energy Income ETF,stocks,us,ARCX,ETF,usd
9056,RNXT,"RenovoRx, Inc. Common Stock",stocks,us,XNAS,CS,usd
9057,ROAD,"Construction Partners, Inc. Class A Common Stock",stocks,us,XNAS,CS,usd
9058,ROAM,Hartford Multifactor Emerging Markets ETF,stocks,us,ARCX,ETF,usd
9059,ROBN,T-Rex 2X Long HOOD Daily Target ETF,stocks,us,BATS,ETF,usd
9060,ROBO,ROBO Global Robotics & Automation Index ETF,stocks,us,ARCX,ETF,usd
9061,ROBT,First Trust Nasdaq Artificial Intelligence and Robotics ETF,stocks,us,XNAS,ETF,usd
9062,ROCK,"Gibraltar Industries, Inc.",stocks,us,XNAS,CS,usd
9063,RODM,Hartford Multifactor Developed Markets (ex-US) ETF,stocks,us,ARCX,ETF,usd
9064,ROE,EA Series Trust Astoria US Equal Weight Quality Kings ETF,stocks,us,XNAS,ETF,usd
9065,ROG,Rogers Corporation,stocks,us,XNYS,CS,usd
9066,ROIV,Roivant Sciences Ltd. Common Shares,stocks,us,XNAS,CS,usd
9067,ROK,"Rockwell Automation, Inc.",stocks,us,XNYS,CS,usd
9068,ROKT,SPDR S&P Kensho Final Frontiers ETF,stocks,us,ARCX,ETF,usd
9069,ROKU,"Roku, Inc. Class A Common Stock",stocks,us,XNAS,CS,usd
9070,ROL,"Rollins, Inc.",stocks,us,XNYS,CS,usd
9071,ROLR,"High Roller Technologies, Inc.",stocks,us,XASE,CS,usd
9072,ROM,ProShares Ultra Technology,stocks,us,ARCX,ETF,usd
9073,ROMA,Roma Green Finance Limited Ordinary Shares,stocks,us,XNAS,CS,usd
9074,ROMO,Strategy Shares Newfound/ReSolve Robust Momentum ETF,stocks,us,BATS,ETF,usd
9075,ROOT,"Root, Inc. Class A Common Stock",stocks,us,XNAS,CS,usd
9076,ROP,"Roper Technologies, Inc. Common Stock",stocks,us,XNAS,CS,usd
9077,ROPE,Coastal Compass 100 ETF,stocks,us,ARCX,ETF,usd
9078,ROSC,Hartford Multifactor Small Cap ETF,stocks,us,ARCX,ETF,usd
9079,ROST,Ross Stores Inc,stocks,us,XNAS,CS,usd
9080,ROUS,Hartford Multifactor US Equity ETF,stocks,us,ARCX,ETF,usd
9081,RPAR,RPAR Risk Parity ETF,stocks,us,ARCX,ETF,usd
9082,RPAY,Repay Holdings Corporation Class A Common Stock,stocks,us,XNAS,CS,usd
9083,RPD,"Rapid7, Inc. Common Stock",stocks,us,XNAS,CS,usd
9084,RPG,Invesco S&P 500 Pure Growth ETF,stocks,us,ARCX,ETF,usd
9085,RPGL,Republic Power Group Limited Class A Ordinary Shares,stocks,us,XNAS,CS,usd
9086,RPHS,Regents Park Hedged Market Strategy ETF,stocks,us,BATS,ETF,usd
9087,RPID,"Rapid Micro Biosystems, Inc. Class A Common Stock",stocks,us,XNAS,CS,usd
9088,RPM,"RPM International, Inc.",stocks,us,XNYS,CS,usd
9089,RPRX,Royalty Pharma plc Class A Ordinary Shares,stocks,us,XNAS,CS,usd
9090,RPT,Rithm Property Trust Inc.,stocks,us,XNYS,CS,usd
9091,RPTX,Repare Therapeutics Inc. Common Shares,stocks,us,XNAS,CS,usd
9092,RPTpC,Rithm Property Trust Inc. 9.875% Series C Fixed-to-Floating Rate Cumulative Redeemable Preferred Stock,stocks,us,XNYS,PFD,usd
9093,RPV,Invesco S&P 500 Pure Value ETF,stocks,us,ARCX,ETF,usd
9094,RQI,"COHEN & STEERS QUALITY INCOME REALTY FUND, INC. COMMON SHARES",stocks,us,XNYS,FUND,usd
9095,RR,Richtech Robotics Inc. Class B Common Stock,stocks,us,XNAS,CS,usd
9096,RRBI,"Red River Bancshares, Inc. Common Stock",stocks,us,XNAS,CS,usd
9097,RRC,Range Resources Corp,stocks,us,XNYS,CS,usd
9098,RRGB,Red Robin Gourmet Burgers Inc,stocks,us,XNAS,CS,usd
9099,RRR,"Red Rock Resorts, Inc. Class A Common Stock",stocks,us,XNAS,CS,usd
9100,RRX,Regal Rexnord Corporation,stocks,us,XNYS,CS,usd
9101,RS,"Reliance, Inc.",stocks,us,XNYS,CS,usd
9102,RSBA,Return Stacked Bonds & Merger Arbitrage ETF,stocks,us,BATS,ETF,usd
9103,RSBT,Return Stacked Bonds & Managed Futures ETF,stocks,us,BATS,ETF,usd
9104,RSBY,Return Stacked Bonds & Futures Yield ETF,stocks,us,BATS,ETF,usd
9105,RSDE,FT Vest U.S. Equity Equal Weight Buffer ETF - December,stocks,us,ARCX,ETS,usd
9106,RSEE,Rareview Systematic Equity ETF,stocks,us,BATS,ETF,usd
9107,RSF,"RiverNorth Capital and Income Fund, Inc.",stocks,us,XNYS,FUND,usd
9108,RSG,Republic Services Inc.,stocks,us,XNYS,CS,usd
9109,RSHO,Tema American Reshoring ETF,stocks,us,ARCX,ETF,usd
9110,RSI,"Rush Street Interactive, Inc.",stocks,us,XNYS,CS,usd
9111,RSJN,FT Vest U.S. Equity Equal Weight Buffer ETF - June,stocks,us,ARCX,ETS,usd
9112,RSKD,Riskified Ltd.,stocks,us,XNYS,CS,usd
9113,RSMC,Rockefeller U.S. Small-Mid Cap ETF,stocks,us,ARCX,ETF,usd
9114,RSMR,FT Vest U.S. Equity Equal Weight Buffer ETF - March,stocks,us,ARCX,ETF,usd
9115,RSMV,Relative Strength Managed Volatility Strategy ETF,stocks,us,ARCX,ETF,usd
9116,RSP,Invesco S&P 500 Equal Weight ETF,stocks,us,ARCX,ETF,usd
9117,RSPA,Invesco S&P 500 Equal Weight Income Advantage ETF,stocks,us,ARCX,ETF,usd
9118,RSPC,Invesco Exchange-Traded Fund Trust Invesco S&P 500 Equal Weight Communication Services ETF,stocks,us,ARCX,ETF,usd
9119,RSPD,Invesco S&P 500 Equal Weight Consumer Discretionary ETF,stocks,us,ARCX,ETF,usd
9120,RSPE,Invesco ESG S&P 500 Equal Weight ETF,stocks,us,ARCX,ETF,usd
9121,RSPF,Invesco S&P 500 Equal Weight Financials ETF,stocks,us,ARCX,ETF,usd
9122,RSPG,Invesco S&P 500 Equal Weight Energy ETF,stocks,us,ARCX,ETF,usd
9123,RSPH,Invesco S&P 500 Equal Weight Health Care ETF,stocks,us,ARCX,ETF,usd
9124,RSPM,Invesco S&P 500 Equal Weight Materials ETF,stocks,us,ARCX,ETF,usd
9125,RSPN,Invesco S&P 500 Equal Weight Industrials ETF,stocks,us,ARCX,ETF,usd
9126,RSPR,Invesco S&P 500 Equal Weight Real Estate ETF,stocks,us,ARCX,ETF,usd
9127,RSPS,Invesco S&P 500 Equal Weight Consumer Staples ETF,stocks,us,ARCX,ETF,usd
9128,RSPT,Invesco S&P 500 Equal Weight Technology ETF,stocks,us,ARCX,ETF,usd
9129,RSPU,Invesco S&P 500 Equal Weight Utilities ETF,stocks,us,ARCX,ETF,usd
9130,RSSB,Return Stacked Global Stocks & Bonds ETF,stocks,us,BATS,ETF,usd
9131,RSSE,FT Vest U.S. Equity Equal-Weight Buffer ETF September,stocks,us,ARCX,ETS,usd
9132,RSSL,Global X Russell 2000 ETF,stocks,us,ARCX,ETF,usd
9133,RSSS,RESEARCH SOLUTIONS INC,stocks,us,XNAS,CS,usd
9134,RSST,Return Stacked U.S. Stocks & Managed Futures ETF,stocks,us,BATS,ETF,usd
9135,RSSX,Return Stacked U.S. Stocks & Gold/Bitcoin ETF,stocks,us,BATS,ETF,usd
9136,RSSY,Return Stacked U.S. Stocks & Futures Yield ETF,stocks,us,BATS,ETF,usd
9137,RSVR,"Reservoir Media, Inc. Common Stock",stocks,us,XNAS,CS,usd
9138,RSVRW,"Reservoir Media, Inc. Warrant",stocks,us,XNAS,WARRANT,usd
9139,RTAC,Renatus Tactical Acquisition Corp I Class A Ordinary Shares,stocks,us,XNAS,CS,usd
9140,RTACU,Renatus Tactical Acquisition Corp I Unit,stocks,us,XNAS,UNIT,usd
9141,RTACW,Renatus Tactical Acquisition Corp I Warrant,stocks,us,XNAS,WARRANT,usd
9142,RTAI,Rareview Tax Advantaged Income ETF,stocks,us,BATS,ETF,usd
9143,RTH,VanEck Retail ETF,stocks,us,XNAS,ETF,usd
9144,RTO,Rentokil Initial plc American Depositary Shares (each representing five (5) Ordinary Shares),stocks,us,XNYS,ADRC,usd
9145,RTRE,Rareview Total Return Bond ETF,stocks,us,BATS,ETF,usd
9146,RTX,RTX Corporation,stocks,us,XNYS,CS,usd
9147,RTXG,Leverage Shares 2X Long RTX Daily ETF,stocks,us,XNAS,ETF,usd
9148,RUBI,Rubico Inc. Common Stock,stocks,us,XNAS,CS,usd
9149,RULE,Adaptive Core ETF,stocks,us,BATS,ETF,usd
9150,RUM,Rumble Inc. Class A Common Stock,stocks,us,XNAS,CS,usd
9151,RUMBW,Rumble Inc. Warrant,stocks,us,XNAS,WARRANT,usd
9152,RUN,Sunrun Inc,stocks,us,XNAS,CS,usd
9153,RUNN,Strategic Trust Running Oak Efficient Growth ETF,stocks,us,XNAS,ETF,usd
9154,RUSC,Russell Investments Exchange Traded Funds Russell Investments U.S. Small Cap Equity ETF,stocks,us,XNAS,ETF,usd
9155,RUSHA,Rush Enterprises Inc,stocks,us,XNAS,CS,usd
9156,RUSHB,Rush Enterprises Inc,stocks,us,XNAS,CS,usd
9157,RVER,Trenchless Fund ETF,stocks,us,ARCX,ETF,usd
9158,RVLV,"Revolve Group, Inc.",stocks,us,XNYS,CS,usd
9159,RVMD,"Revolution Medicines, Inc. Common Stock",stocks,us,XNAS,CS,usd
9160,RVMDW,"Revolution Medicines, Inc. Warrant",stocks,us,XNAS,WARRANT,usd
9161,RVNL,GraniteShares 2x Long RIVN Daily ETF,stocks,us,XNAS,ETF,usd
9162,RVNU,Xtrackers Municipal Infrastructure Revenue Bond ETF,stocks,us,ARCX,ETF,usd
9163,RVP,"Retractable Technologies, Inc",stocks,us,XASE,CS,usd
9164,RVPH,"Reviva Pharmaceuticals Holdings, Inc. Common Stock",stocks,us,XNAS,CS,usd
9165,RVPHW,"Reviva Pharmaceuticals Holdings, Inc. Warrants",stocks,us,XNAS,WARRANT,usd
9166,RVRB,Reverb ETF,stocks,us,BATS,ETF,usd
9167,RVSB,Riverview Bancorp Inc,stocks,us,XNAS,CS,usd
9168,RVSN,Rail Vision Ltd. Ordinary Share,stocks,us,XNAS,CS,usd
9169,RVSNW,Rail Vision Ltd. Warrant,stocks,us,XNAS,WARRANT,usd
9170,RVT,"Royce Small-Cap Trust, Inc.",stocks,us,XNYS,FUND,usd
9171,RVTY,"Revvity, Inc.",stocks,us,XNYS,CS,usd
9172,RVYL,Ryvyl Inc. Common Stock,stocks,us,XNAS,CS,usd
9173,RW,Rainwater Equity ETF,stocks,us,ARCX,ETF,usd
9174,RWAY,Runway Growth Finance Corp. Common Stock,stocks,us,XNAS,CS,usd
9175,RWAYL,Runway Growth Finance Corp. 7.50% Notes due 2027,stocks,us,XNAS,CS,usd
9176,RWAYZ,Runway Growth Finance Corp. 8.00% Notes due 2027,stocks,us,XNAS,CS,usd
9177,RWJ,Invesco S&P SmallCap 600 Revenue ETF,stocks,us,ARCX,ETF,usd
9178,RWK,Invesco S&P MidCap 400 Revenue ETF,stocks,us,ARCX,ETF,usd
9179,RWL,Invesco S&P 500 Revenue ETF,stocks,us,ARCX,ETF,usd
9180,RWM,ProShares Short Russell2000,stocks,us,ARCX,ETF,usd
9181,RWO,SPDR  Dow Jones  Global Real Estate ETF,stocks,us,ARCX,ETF,usd
9182,RWR,SPDR Dow Jones REIT ETF,stocks,us,ARCX,ETF,usd
9183,RWT,"Redwood Trust, Inc.",stocks,us,XNYS,CS,usd
9184,RWTN,"Redwood Trust, Inc. 9.125% Senior Notes Due 2029",stocks,us,XNYS,SP,usd
9185,RWTO,"Redwood Trust, Inc. 9.00% Senior Notes Due 2029",stocks,us,XNYS,SP,usd
9186,RWTP,"Redwood Trust, Inc. 9.125% Senior Notes Due 2030",stocks,us,XNYS,SP,usd
9187,RWTpA,"Redwood Trust, Inc. 10.00% Series A Fixed-Rate Reset Cumulative Redeemable Preferred Stock",stocks,us,XNYS,PFD,usd
9188,RWX,SPDR Dow Jones  International Real Estate ETF,stocks,us,ARCX,ETF,usd
9189,RXD,ProShares UltraShort Health Care,stocks,us,ARCX,ETF,usd
9190,RXI,iShares Global Consumer Discretionary ETF,stocks,us,ARCX,ETF,usd
9191,RXL,ProShares Ultra Health Care,stocks,us,ARCX,ETF,usd
9192,RXO,"RXO, Inc.",stocks,us,XNYS,CS,usd
9193,RXRX,"Recursion Pharmaceuticals, Inc. Class A Common Stock",stocks,us,XNAS,CS,usd
9194,RXST,"RxSight, Inc. Common Stock",stocks,us,XNAS,CS,usd
9195,RXT,"Rackspace Technology, Inc. Common Stock",stocks,us,XNAS,CS,usd
9196,RY,Royal Bank of Canada,stocks,us,XNYS,CS,usd
9197,RYAAY,Ryanair Holdings plc American Depositary Shares,stocks,us,XNAS,ADRC,usd
9198,RYAM,Rayonier Advanced Materials Inc.,stocks,us,XNYS,CS,usd
9199,RYAN,"Ryan Specialty Holdings, Inc.",stocks,us,XNYS,CS,usd
9200,RYDE,Ryde Group Ltd.,stocks,us,XASE,CS,usd
9201,RYET,Ruanyun Edai Technology Inc. Ordinary shares,stocks,us,XNAS,CS,usd
9202,RYI,RYERSON HOLDING CORPORATION,stocks,us,XNYS,CS,usd
9203,RYLD,Global X Russell 2000 Covered Call ETF,stocks,us,ARCX,ETF,usd
9204,RYLG,Global X Russell 2000 Covered Call & Growth ETF,stocks,us,ARCX,ETF,usd
9205,RYM,"RYTHM, Inc. Common Stock",stocks,us,XNAS,CS,usd
9206,RYN,Rayonier Inc.,stocks,us,XNYS,CS,usd
9207,RYOJ,"rYojbaba Co., Ltd. Common Shares",stocks,us,XNAS,CS,usd
9208,RYSE,Vest 10 Year Interest Rate Hedge ETF,stocks,us,BATS,ETF,usd
9209,RYTM,"Rhythm Pharmaceuticals, Inc. Common Stock",stocks,us,XNAS,CS,usd
9210,RZB,"Reinsurance Group of America, Incorporated 5.75% Fixed-To-Floating Rate Subordinated Debentures due 2056",stocks,us,XNYS,SP,usd
9211,RZC,"Reinsurance Group of America, Incorporated 7.125% Fixed-Rate Reset Subordinated Debentures due 2052",stocks,us,XNYS,SP,usd
9212,RZG,Invesco S&P SmallCap 600 Pure Growth ETF,stocks,us,ARCX,ETF,usd
9213,RZLT,"Rezolute, Inc. Common Stock (NV)",stocks,us,XNAS,CS,usd
9214,RZLV,Rezolve AI PLC Ordinary Shares,stocks,us,XNAS,CS,usd
9215,RZLVW,Rezolve AI PLC Warrants,stocks,us,XNAS,WARRANT,usd
9216,RZV,Invesco S&P SmallCap 600 Pure Value ETF,stocks,us,ARCX,ETF,usd
9217,S,"SentinelOne, Inc.",stocks,us,XNYS,CS,usd
9218,SA,"Seabridge Gold, Inc.",stocks,us,XNYS,CS,usd
9219,SAA,ProShares Ulta SmallCap600,stocks,us,ARCX,ETF,usd
9220,SABA,Saba Capital Income & Opportunities Fund II,stocks,us,XNYS,FUND,usd
9221,SABR,Sabre Corporation,stocks,us,XNAS,CS,usd
9222,SABS,"SAB Biotherapeutics, Inc. Common Stock",stocks,us,XNAS,CS,usd
9223,SABSW,"SAB Biotherapeutics, Inc. Warrant",stocks,us,XNAS,WARRANT,usd
9224,SACH,Sachem Capital Corp. Common Shares,stocks,us,XASE,CS,usd
9225,SACHpA,Sachem Capital Corp. 7.75% Series A Cumulative Redeemable Preferred Stock,stocks,us,XASE,PFD,usd
9226,SAEF,Schwab Ariel Opportunities ETF,stocks,us,ARCX,ETF,usd
9227,SAFE,Safehold Inc.,stocks,us,XNYS,CS,usd
9228,SAFT,Safety Insurance Group Inc,stocks,us,XNAS,CS,usd
9229,SAFX,"XCF Global, Inc. Class A Common Stock",stocks,us,XNAS,CS,usd
9230,SAGP,Strategas Global Policy Opportunities ETF,stocks,us,ARCX,ETF,usd
9231,SAGT,SAGTEC GLOBAL LIMITED Ordinary shares,stocks,us,XNAS,CS,usd
9232,SAH,"Sonic Automotive, Inc.",stocks,us,XNYS,CS,usd
9233,SAIA,"Saia, Inc.",stocks,us,XNAS,CS,usd
9234,SAIC,Science Applications International Corporation Common Stock,stocks,us,XNAS,CS,usd
9235,SAIH,SAIHEAT Limited Class A Ordinary Shares,stocks,us,XNAS,CS,usd
9236,SAIHW,SAIHEAT Limited Warrant,stocks,us,XNAS,WARRANT,usd
9237,SAIL,"SailPoint, Inc. Common Stock",stocks,us,XNAS,CS,usd
9238,SAJ,Saratoga Investment Corp. 8.00% Notes due 2027,stocks,us,XNYS,SP,usd
9239,SAM,Boston Beer Company,stocks,us,XNYS,CS,usd
9240,SAMG,Silvercrest Asset Management Group Inc.,stocks,us,XNAS,CS,usd
9241,SAMM,Strategas Macro Momentum ETF,stocks,us,ARCX,ETF,usd
9242,SAMT,Strategas Macro Thematic Opportunities ETF,stocks,us,ARCX,ETF,usd
9243,SAN,Banco Santander S.A.,stocks,us,XNYS,ADRC,usd
9244,SANA,"Sana Biotechnology, Inc. Common Stock",stocks,us,XNAS,CS,usd
9245,SANG,Sangoma Technologies Corporation Common Shares,stocks,us,XNAS,CS,usd
9246,SANM,Sanmina  Corp,stocks,us,XNAS,CS,usd
9247,SAP,SAP SE,stocks,us,XNYS,ADRC,usd
9248,SAPH,SAP SE ADRhedged,stocks,us,ARCX,ETS,usd
9249,SAR,SARATOGA INVESTMENT CORP. NEW,stocks,us,XNYS,CS,usd
9250,SARK,Investment Managers Series Trust II Tradr 1X Short Innovation Daily ETF,stocks,us,XNAS,ETF,usd
9251,SARO,"StandardAero, Inc.",stocks,us,XNYS,CS,usd
9252,SAT,Saratoga Investment Corp. 6.00% Notes due 2027,stocks,us,XNYS,SP,usd
9253,SATL,Satellogic Inc. Class A Ordinary Shares,stocks,us,XNAS,CS,usd
9254,SATLW,Satellogic Inc. Warrant,stocks,us,XNAS,WARRANT,usd
9255,SATO,Invesco Alerian Galaxy Crypto Economy ETF,stocks,us,BATS,ETF,usd
9256,SATS,EchoStar Corporation,stocks,us,XNAS,CS,usd
9257,SAUG,FT Vest U.S. Small Cap Moderate Buffer ETF - August,stocks,us,BATS,ETF,usd
9258,SAVA,"Cassava Sciences, Inc.",stocks,us,XNAS,CS,usd
9259,SAWG,AAM Sawgrass US Large Cap Quality Growth ETF,stocks,us,ARCX,ETF,usd
9260,SAWS,AAM Sawgrass US Small Cap Quality Growth ETF,stocks,us,ARCX,ETF,usd
9261,SAY,Saratoga Investment Corp. 8.125% Notes due 2027,stocks,us,XNYS,SP,usd
9262,SAZ,Saratoga Investment Corp. 8.50% Notes due 2028,stocks,us,XNYS,SP,usd
9263,SB,"Safe Bulkers, Inc.",stocks,us,XNYS,CS,usd
9264,SBAC,SBA Communications Corp,stocks,us,XNAS,CS,usd
9265,SBAR,Simplify Barrier Income ETF,stocks,us,ARCX,ETF,usd
9266,SBB,ProShares Short SmallCap600,stocks,us,ARCX,ETF,usd
9267,SBC,SBC Medical Group Holdings Incorporated Common Stock,stocks,us,XNAS,CS,usd
9268,SBCF,Seacoast Banking Corp of Florida,stocks,us,XNAS,CS,usd
9269,SBCWW,SBC Medical Group Holdings Incorporated Warrants,stocks,us,XNAS,WARRANT,usd
9270,SBDS,"Solo Brands, Inc.",stocks,us,XNYS,CS,usd
9271,SBET,SharpLink Gaming Ltd. Ordinary Shares,stocks,us,XNAS,CS,usd
9272,SBEV,"Splash Beverage Group, Inc.",stocks,us,XASE,CS,usd
9273,SBFG,"SB Financial Group, Inc.",stocks,us,XNAS,CS,usd
9274,SBFM,Sunshine Biopharma Inc.,stocks,us,XNAS,CS,usd
9275,SBFMW,Sunshine Biopharma Inc. warrant,stocks,us,XNAS,WARRANT,usd
9276,SBGI,"Sinclair, Inc. Class A Common Stock",stocks,us,XNAS,CS,usd
